,,,,,,,,,,,,,,Classification path,Level 1 label,Level 1 probability
Ugyq6FJRk2It8fWJwRV4AaABAg,Yagya Dollie,1 month ago,1510997171377,"Weapon sales to Vietnam???
At least America holds no grudges.
What a kick in the teeth of war veterans from the Vietnam war.
First you fight them. Then you rearm them. Bwahahaha!! Dr Evil couldn't do better.",4,true,3,,,,,,,/Negative/,Negative,0.971
,,,,,,,,Ugyq6FJRk2It8fWJwRV4AaABAg.8_0Q4qcTjSb8_0RouZZfHb,The Iranian Liberal,1 month ago,1510997171787,Why not let go of old grudges? We were wrong to go into Vietnam in the first place-lets fix those wrongs.,0,/Negative/,Negative,0.996
,,,,,,,,Ugyq6FJRk2It8fWJwRV4AaABAg.8_0Q4qcTjSb8_0TIku0p0-,Bernard Gilbert,1 month ago,1510997171791,"Sell them the weapons, then use the profits to provide Vietnam vets (and all others) better health care.",0,/Positive/,Positive,0.682
,,,,,,,,Ugyq6FJRk2It8fWJwRV4AaABAg.8_0Q4qcTjSb8_0TrpmUmm3,Ronald Pegues,1 month ago,1510997171794,"Let's repair those wrongs by arming an impoverished Nation to the teeth 😲 and let's take care of the Vietnam vets by selling weapons to Vietnam 😭 
It just got extra stupid!!",0,/Positive/,Positive,0.838
UgyHmJ5uYgpcbY3U3e14AaABAg,Samuel Hornet Wolf,1 month ago,1510997171381,We Sell Death ...,2,false,0,,,,,,,/Neutral/,Neutral,0.713
UgzFWn7G3K47SFZDXHh4AaABAg,lankyeric,1 month ago,1510997171385,I think she sounds better sick....,1,false,0,,,,,,,/Positive/,Positive,0.992
UgwxBo8jgps80JLa4FR4AaABAg,Michael Boyd,1 month ago,1510997172803,His base only care about hurting marginalized groups!,12,false,0,,,,,,,/Negative/,Negative,0.672
UgwDQJ7E6kVvOEhbK754AaABAg,Marina Salas,1 month ago,1510997172807,"Weapon sales are meant to help drive down some of the deficit, caused by the proposed tax cuts. This way he can show that he kept the deficit at bay, while enriching his wealthy friends.",4,true,1,,,,,,,/Positive/,Positive,0.557
,,,,,,,,UgwDQJ7E6kVvOEhbK754AaABAg.8_0PaQiwrgN8_0RBdQHQ9X,yumri4,1 month ago,1510997173326,"yeah but if we sell the weapons are less than we buy them for then we loss money, weapons and the technology / R&D put into those weapons to make them better than who we sell them too have already",0,/Negative/,Negative,0.492
UgwHKPnw-sD_CVzI18h4AaABAg,Beverley Hohn Chang,1 month ago,1510997172814,"Hes  VERY bitter and OLD
He doea not CARE ABOUT WAR.....he already LIVE his LIFE he has NOTHING at all to lose
Now hes OLD and DEMENTIA ridden
WHAT the heck if he put YOU UP FRONT of the BOMBINGS...
PAUSE",1,true,1,,,,,,,/Negative/,Negative,0.99
,,,,,,,,UgwHKPnw-sD_CVzI18h4AaABAg.8_0PGcFH4li8_0RL0J6_2Y,yumri4,1 month ago,1510997173282,"so someone should poison him on one of his trips most easy in one of his "" strong "" handshakes",0,/Positive/,Positive,0.998
UgyoasMmm7KTOQvVcOx4AaABAg,Michael Boyd,1 month ago,1510997172819,His base would give zero f)&ks if trump were to sell their 14 year old daughters on the black market!!,9,true,1,,,,,,,/Negative/,Negative,0.984
,,,,,,,,UgyoasMmm7KTOQvVcOx4AaABAg.8_0PB-WGq8j8_0Q50a5ePW,Szriko,1 month ago,1510997173319,"+Michael Boyd
Why would they? Women have next to no worth anyway. Selling a fourteen year old daughter would hopefully recoup all the losses of raising them. Women have been the target of a horrible, truly cruel misinformation campaign for a century now - The idea that they're 'intelligent', 'capable', 'independent' is a bunch of nonsense designed to destabilize and destroy society. If they were truly intelligent, they'd have never bought into it.",0,/Negative/,Negative,0.969
UgynBIp5fht_edJ95uJ4AaABAg,Michael Boyd,1 month ago,1510997172826,Draining the swamp through weapons sales. How about that for American first?,4,false,0,,,,,,,/Neutral/,Neutral,0.518
UgwjMqgTpyjedlOsyol4AaABAg,SpiderBurger,1 month ago,1510997172829,NO TRUMP NO KKK NO FASCIST USA! NO TRUMP NO KKK NO FASCIST USA! NO TRUMP NO KKK NO FASCIST USA!,11,true,1,,,,,,,/Negative/,Negative,1
,,,,,,,,UgwjMqgTpyjedlOsyol4AaABAg.8_0Odg0pFQY8_0PErITooP,dog guy,1 month ago,1510997173260,Reeeeeeeeee,1,/Negative/,Negative,1
UgyAVLe2gLy_4TGH1Rl4AaABAg,Langdon,1 month ago,1510997172835,It is your biggest export.,3,true,2,,,,,,,/Positive/,Positive,0.994
,,,,,,,,UgyAVLe2gLy_4TGH1Rl4AaABAg.8_0OIT5BBZI8_0RRVhlz9G,yumri4,1 month ago,1510997173342,sad but probably true right after refined oil not oil but refined oil products,0,/Positive/,Positive,0.578
,,,,,,,,UgyAVLe2gLy_4TGH1Rl4AaABAg.8_0OIT5BBZI8_0RqYIEu0l,Langdon,1 month ago,1510997173346,Actually 'entertainment' is second.  You sell weapons and propaganda (alas the propaganda part is lagging a bit behind these days.),0,/Negative/,Negative,0.586
UgzXsRPRwxfUEaKF-d54AaABAg,Steven perdue,1 month ago,1510997172841,Draining the swamp?,1,true,2,,,,,,,/Positive/,Positive,0.635
,,,,,,,,UgzXsRPRwxfUEaKF-d54AaABAg.8_0OEFIea6-8_0PFtmmfwr,thatdudewhoknosthatbrowhoknosthatguy,1 month ago,1510997173271,Steven perdue nothings what it seems...  world peace? Get ready for a shit load of paper work and alotta lame watered down shit you thought was gonna be better...,0,/Negative/,Negative,0.971
,,,,,,,,UgzXsRPRwxfUEaKF-d54AaABAg.8_0OEFIea6-8_0S0CTKV0w,yumri4,1 month ago,1510997173274,"world peace would last for like a day unless it is under a dictatorship to which they will kill and make submit to the will of the state everyone so world peace in a commonly thought way is impossible world peace being kept up by a police state and a surveillance state is possible but also you get a dystopia instead of a utopia 
for Trump i do not think he wants world peace as it will cut into his personal and family business plans",0,/Negative/,Negative,0.764
UgxqJ974QxI-rt0yiZt4AaABAg,SocialDoc: TryYourMedicine,1 month ago,1510997172886,"The orange cartoon is an arms dealer, yes we know.",9,false,0,,,,,,,/Negative/,Negative,0.516
Ugy1QzFfwA0Ifo4PzzF4AaABAg,Lar M,1 month ago,1510997172890,Trash posting by the Young Turd.,3,true,1,,,,,,,/Positive/,Positive,0.494
,,,,,,,,Ugy1QzFfwA0Ifo4PzzF4AaABAg.8_0OC9izozk8_0Vl0HrNJ_,HerkimerSnerd,1 month ago,1510997173373,You sound desperate and triggered.,0,/Positive/,Positive,0.996
Ugxnt0SklAQQN49sMkZ4AaABAg,Brad Wray,1 month ago,1510997172896,"Sounds like a great way to let our technology fall into the wrong hands. Just plain dot, dot, dot,,,dot, dot, dot well Trumps a fu___ing idot!",3,false,0,,,,,,,/Positive/,Positive,0.904
Ugym5dvXz1KZWNBxxRp4AaABAg,John Frank,1 month ago,1510997172899,"America has a 72 billion dollar arms increase on the burner, money that could be used to benefit Americans. They are basically lying about the American military readiness in order that billionaires can secure government arms contract manufacturing weapons that are being stored rather than in use.",10,true,1,,,,,,,/Negative/,Negative,0.832
,,,,,,,,Ugym5dvXz1KZWNBxxRp4AaABAg.8_0NnK-hMtl8_0TdIrLQ4q,JoeyFiveandDimes,1 month ago,1510997173332,John Frank <<<< Read my comment / reply above re: PlacidDragon . Capitalism is a RACKET !,0,/Positive/,Positive,0.914
UgygC5MoRQcZrikrEEx4AaABAg,humboldthammer,1 month ago,1510997172906,"The Devil wants the world well-armed.   Trump is the False Prophet (false profit).    Xi is the dragon. (Nixon, spelled inside out, is Xionn) And Putin is  PUT IN charge of the  2nd beast in Daniel 7: 5.   (arise devour much flesh) 
     We are about to be tricked into the war that proves most men are unfit for God's Kingdom -- IS i vs I AM vs URN't -- unless we Overcome. 03/22/2030 is the Beginning of the 3rd, 1000-year day of Heaven since Jesus taught us the Brotherhood of ALL Men. We are told He comes SOONER. and 1,260 days sooner, is just after the autumn equinox of the Illuminati's 250th year (1776-2026).   
      They have a Jubilee planned to forgive our huge war-debt -- as all the people cry out, ""No more war. Save us. We will do Anything!""   The Art of the Deal  step 4: Make them pay for what they want. Especially,  if you got them by the balls.  Trump said, ""I am the only one who can save you.""",2,true,1,,,,,,,/Negative/,Negative,0.545
,,,,,,,,UgygC5MoRQcZrikrEEx4AaABAg.8_0NdGO_ubD8_0OHxpiF6y,Steven perdue,1 month ago,1510997173354,humboldthammer lol,1,/Positive/,Positive,0.998
UgxsuBv_upSA8uttszZ4AaABAg,TollFree999,1 month ago,1510997172911,So he's pretty much just a slimy arms dealer.,6,false,0,,,,,,,/Negative/,Negative,0.965
Ugx7r_OxQQ5EJeDl5D94AaABAg,Donald Trump,1 month ago,1510997172915,"keep trying bitches.... keep trying.... hahahahahahahahaahahahaha   The alpha wins, and the betas keep whining after him.... GG",2,true,10,,,,,,,/Negative/,Negative,0.643
,,,,,,,,Ugx7r_OxQQ5EJeDl5D94AaABAg.8_0N_k40IrQ8_0Ntvk0MtC,Jebus Hypocristos,1 month ago,1510997173433,You are scared little beta hiding online from women...LULZ typical DOTURD loser.,3,/Negative/,Negative,0.92
,,,,,,,,Ugx7r_OxQQ5EJeDl5D94AaABAg.8_0N_k40IrQ8_0ONE5aXSK,thatdudewhoknosthatbrowhoknosthatguy,1 month ago,1510997173438,Arjun Rajput get outta here go back to your shitty country  fake ass red dot bitch. Snooty fuckas,0,/Negative/,Negative,0.998
,,,,,,,,Ugx7r_OxQQ5EJeDl5D94AaABAg.8_0N_k40IrQ8_0Olkee0zo,Cascail Ryker,1 month ago,1510997173443,Arjun Rajput. if Trump is an Alpha  what does an Alpha look like? An insecure bumbeling moron? Funny conception of Alphas.,1,/Positive/,Positive,0.543
,,,,,,,,Ugx7r_OxQQ5EJeDl5D94AaABAg.8_0N_k40IrQ8_0PUjI5Hp_,Donald Trump,1 month ago,1510997173447,"only the mediocre and the cheap care about looks. for example, American women.",1,/Negative/,Negative,0.998
,,,,,,,,Ugx7r_OxQQ5EJeDl5D94AaABAg.8_0N_k40IrQ8_0PYh54_gd,SocialDoc: TryYourMedicine,1 month ago,1510997173454,"Nice mindset rajCHOOT. You wreak of Indian POA loser mentality, desperately trying to convince yourself this alpha crap works. I'd love to see you try to pick up a Trump supporter, she will spit in your face and then her racist friends will stomp your alpha ch**t allover the place. What a confused individual you are.",0,/Negative/,Negative,0.748
,,,,,,,,Ugx7r_OxQQ5EJeDl5D94AaABAg.8_0N_k40IrQ8_0Pg0kL97Z,SocialDoc: TryYourMedicine,1 month ago,1510997173459,Jebus Hypocristos -- Lol..love your avatar. Now make one with zioNazis. Dare you.,0,/Negative/,Negative,0.979
,,,,,,,,Ugx7r_OxQQ5EJeDl5D94AaABAg.8_0N_k40IrQ8_0PuUT22qd,Donald Trump,1 month ago,1510997173465,"the fact is that he won, he was smart enough to plan in a way to win... and the msm helped him provide free marketing, thus saving him 2B dollars worth of promotion... i don't care about what happens to americans or about any politician in general.... he knew how to handle the challenge better than any of his competitors, and thus won. now people can try as much as they want to, to put him in a bad light, they will, but it doesn't change the reality.  

it was pretty obvious that most people are smart enough to listen to him and decide, instead of what msm wants people to think... and yet, msm couldn't stop showing him, in an attempt to bitch about him.. no wonder why he won.",1,/Negative/,Negative,0.816
,,,,,,,,Ugx7r_OxQQ5EJeDl5D94AaABAg.8_0N_k40IrQ8_0QCcvZMuU,Donald Trump,1 month ago,1510997173471,"I am not Indian, you retard. wow you americans have really stubborn brains, can't understand stuff in one effort.",1,/Negative/,Negative,0.771
,,,,,,,,Ugx7r_OxQQ5EJeDl5D94AaABAg.8_0N_k40IrQ8_0QhBOX8ch,Szriko,1 month ago,1510997173477,"+Arjun Rajput
Unfortunately, you don't have to be smart to win in American politics. You just need to convince roughly 50,000 people to vote for you. Not a hard task.

Also, the entirety of the supposed 'Alpha/Beta' dynamic relies almost entirely on looks, so backing up that statement with 'Looks don't matter!' hamstrings your own argument.",0,/Negative/,Negative,0.951
,,,,,,,,Ugx7r_OxQQ5EJeDl5D94AaABAg.8_0N_k40IrQ8_0R1BQ-CHj,Phil Hunt,1 month ago,1510997173483,The alpha retard.,0,/Negative/,Negative,0.627
Ugxx7VE8GLduoPpN1Qh4AaABAg,Daniel Kauffman Jr,1 month ago,1510997172920,voters work in defense plants,1,true,1,,,,,,,/Neutral/,Neutral,0.588
,,,,,,,,Ugxx7VE8GLduoPpN1Qh4AaABAg.8_0NUN98nmJ8_0NyWaGbf9,Jebus Hypocristos,1 month ago,1510997173290,VERY FEW voters work in the defense industry. You lie as badly as DOTARD the village idiot.,0,/Negative/,Negative,0.891
UgzSLhpSh9jOTKp2szB4AaABAg,Colonel 100,1 month ago,1510997172928,"trump wants to wage war around the world
as long as usa makes money from it",15,true,3,,,,,,,/Positive/,Positive,0.908
,,,,,,,,UgzSLhpSh9jOTKp2szB4AaABAg.8_0NSn9Pvzc8_0ODWqIAlN,dancinkindofguy,1 month ago,1510997173306,Colonel 100 TYT wants to spread Islamic Jihad around the world.,0,/Positive/,Positive,0.809
,,,,,,,,UgzSLhpSh9jOTKp2szB4AaABAg.8_0NSn9Pvzc8_0Puyh3smu,Ham Burgler,1 month ago,1510997173309,"dancinkindofguy
Say what? hahahahahahahahahaha!",2,/Negative/,Negative,0.943
,,,,,,,,UgzSLhpSh9jOTKp2szB4AaABAg.8_0NSn9Pvzc8_2KgJ8T1as,hamza abid,1 month ago,1510997173312,+dancinkindofguy sheeple.,1,/Negative/,Negative,0.943
UgzdZ4D3lesl8JiFrR94AaABAg,gcirc,1 month ago,1510997172934,Spread war and death and go church on Sunday and preach love,5,false,0,,,,,,,/Positive/,Positive,0.99
Ugw-fcpRnkWCtNWXsbp4AaABAg,SeeNoEvL65,1 month ago,1510997172938,Kind of want Ana voice to stay like that,1,false,0,,,,,,,/Negative/,Negative,0.93
Ugz1Pqd44VepIvllLB14AaABAg,Zachary Xavier,1 month ago,1510997172942,The Trump tards who always were bigoted against Muslims don't say a word while Trump is selling weapons to Saudi Arabia. HA!,8,true,2,,,,,,,/Negative/,Negative,0.938
,,,,,,,,Ugz1Pqd44VepIvllLB14AaABAg.8_0NDyNT0_T8_0ORsXqoTh,dancinkindofguy,1 month ago,1510997173363,Zachary Xavier TYT REGESSIVES pretend that Islam isnt a death cult that doesnt average 5 jihad attacks a day.,0,/Negative/,Negative,0.92
,,,,,,,,Ugz1Pqd44VepIvllLB14AaABAg.8_0NDyNT0_T8_0Q6HT4a20,Ham Burgler,1 month ago,1510997173366,"dancinkindofguy 
Say what? Hahahahahahahahaha!",1,/Negative/,Negative,0.943
Ugw-D9cqUfBawTiK6eF4AaABAg,John Frank,1 month ago,1510997174407,"The private contractors are his friends they are all fairly in his tax bracket many beyond. He is keeping his promises to the fools who put him in office, pandering to the very rich and neglecting the actual job of the presidency. If anything he should have been convincing other nations to stand down instead of buying weapons of war.",3,false,0,,,,,,,/Positive/,Positive,0.527
UgwraL-aq9E3TuUPFmh4AaABAg,Goahead,1 month ago,1510997174415,"I knew that one of his main agendas was to sell weapons in Asia for his trip.
We sell weapons to the world. If there was world peace, many companies here will go out of business. For example, Lockheed Martin.",2,false,0,,,,,,,/Negative/,Negative,0.492
UgwaG0Fyd1OT9d_NtT54AaABAg,trev moffatt,1 month ago,1510997174422,like those we sold Saddam and the Ayatollah. Nice piece of business,3,false,0,,,,,,,/Positive/,Positive,0.975
UgxqyDPvaYPQivq6CeZ4AaABAg,elftax,1 month ago,1510997174430,"All administrations try selling weapons, Trump has not realized the trick of offering aid and then telling countries to use it to purchase American weaponry.",2,false,0,,,,,,,/Negative/,Negative,0.719
UgzYv2te6Bd5_34lUWZ4AaABAg,Lar M,1 month ago,1510997174438,Young Turd crappy imagination.Selling weapons to other countries has been the practice of USA since the Boxer Rebellion in China.,1,true,2,,,,,,,/Negative/,Negative,0.777
,,,,,,,,UgzYv2te6Bd5_34lUWZ4AaABAg.8_0MP-430Hq8_0NxAyDq6S,humboldthammer,1 month ago,1510997175129,"The un-seen devil wants the world well-armed. Trump is the False Prophet (false profit).    Xi is the dragon. (Nixon, spelled inside out, is Xionn) And Putin is  PUT IN charge of the  2nd beast in Daniel 7: 5.   (arise devour much flesh) 
     We are about to be tricked into the war that proves most men are unfit for God's Kingdom -- IS i vs I AM vs URN't -- unless we Overcome. 03/22/2030 is the Beginning of the 3rd, 1000-year day of Heaven since Jesus taught us the Brotherhood of ALL Men. We are told He comes SOONER. and 1,260 days sooner, is just after the autumn equinox of the Illuminati's 250th year (1776-2026).   
      They have a Jubilee planned to forgive our huge war-debt -- as all the people cry out, ""No more war. Save us. We will do Anything!""   The Art of the Deal  step 4: Make them pay for what they want. Especially,  if you got them by the balls.  Trump said, ""I am the only one who can save you.""",0,/Negative/,Negative,0.525
,,,,,,,,UgzYv2te6Bd5_34lUWZ4AaABAg.8_0MP-430Hq8_0VxGX9eS9,IamDennis .Ok,1 month ago,1510997175131,Lar M I'm not trying to pull a what about Obama but it would have been nice to see reports when he was in office for consistency reasons.  Sales skyrocketed during his last 4 yrs and the inconsistencies make it hard to take them seriously now.,0,/Negative/,Negative,0.846
UgxwtMNObeh3sWyRNnx4AaABAg,Ben Quinney,1 month ago,1510997174447,American weapons cost too much,0,true,2,,,,,,,/Negative/,Negative,0.984
,,,,,,,,UgxwtMNObeh3sWyRNnx4AaABAg.8_0MOGyEJ6S8_0MeMh2y2-,Lar M,1 month ago,1510997175121,America has dirt cheap 10th hand weapons sold to Syria. This is how much they can afford in exchange for their dead camels !,0,/Negative/,Negative,0.885
,,,,,,,,UgxwtMNObeh3sWyRNnx4AaABAg.8_0MOGyEJ6S8_0N7TeuVvc,Snoopy,1 month ago,1510997175123,Just get the Chinese knock offs instead,0,/Neutral/,Neutral,0.975
UgzoW5HzAyyd4s9qzy94AaABAg,Gouky,1 month ago,1510997174456,Weapon Manufacturing = Jobs,2,true,9,,,,,,,/Negative/,Negative,0.732
,,,,,,,,UgzoW5HzAyyd4s9qzy94AaABAg.8_0MJ0HmWX28_0MQnrVGbA,Colonel 100,1 month ago,1510997175167,arming terrorist = jobs,2,/Negative/,Negative,0.883
,,,,,,,,UgzoW5HzAyyd4s9qzy94AaABAg.8_0MJ0HmWX28_0MRTE9h7c,William Slaughter,1 month ago,1510997175169,"abusing position to drive up sales for a company in your stock portfolio
= CONFLICT OF INTEREST",2,/Negative/,Negative,0.908
,,,,,,,,UgzoW5HzAyyd4s9qzy94AaABAg.8_0MJ0HmWX28_0Mg46E7uO,Peter Chen,1 month ago,1510997175171,"So does a Green Economy, but you don't see conservatives rushing towards that.",1,/Negative/,Negative,0.553
,,,,,,,,UgzoW5HzAyyd4s9qzy94AaABAg.8_0MJ0HmWX28_0Mly13Cvk,Lar M,1 month ago,1510997175173,The Clinton has already started this with their creation of ISIS in 2015 when Trump was still in 5th Avenue New York City.,0,/Negative/,Negative,0.598
,,,,,,,,UgzoW5HzAyyd4s9qzy94AaABAg.8_0MJ0HmWX28_0MvibYRB8,Lar M,1 month ago,1510997175174,This is why the Clinton Foundation is not list in the Stock Exchange with their revenue from the selling of 20% US Uranium to Russia.This is the act of treason.,0,/Negative/,Negative,0.879
,,,,,,,,UgzoW5HzAyyd4s9qzy94AaABAg.8_0MJ0HmWX28_0N3sxWYET,William Slaughter,1 month ago,1510997175176,"so the US was responsible for ISIS...
then it is our RESPONSIBILITY to take care of the refugees we essentially created...
""buh buh turrurreest mooslems!""
you mean the terrorists that were naturalized or natural born citizens? people who were in this country WELL BEFORE the refugee crisis started?",1,/Positive/,Positive,0.463
,,,,,,,,UgzoW5HzAyyd4s9qzy94AaABAg.8_0MJ0HmWX28_0NKWUnl6i,trev moffatt,1 month ago,1510997175178,profits too,0,/Negative/,Negative,0.998
,,,,,,,,UgzoW5HzAyyd4s9qzy94AaABAg.8_0MJ0HmWX28_0O6DjfDhc,Jebus Hypocristos,1 month ago,1510997175180,SCREW JOBS for American taxpayers. The MIC screwing US taxpayers dry without lube.,0,/Negative/,Negative,0.887
,,,,,,,,UgzoW5HzAyyd4s9qzy94AaABAg.8_0MJ0HmWX28_0Oo2hQhcB,Steven perdue,1 month ago,1510997175182,Lar M Clinton would slap your mouth.,0,/Negative/,Negative,0.58
UgwFjwVQXXHX0EHdQn14AaABAg,Len Martin,1 month ago,1510997174464,Phallicly speaking Trump is trying to Market his Derringer,2,true,1,,,,,,,/Negative/,Negative,0.846
,,,,,,,,UgwFjwVQXXHX0EHdQn14AaABAg.8_0MBJkzXNq8_0O7F9Xrm2,humboldthammer,1 month ago,1510997175092,"How come we never see Trump's dick flopping around like Michelle's? Is Trump dickless?   Just asking questions, like Alex Jones.",0,/Negative/,Negative,0.758
UgwpnLIpagv1e2e2jFh4AaABAg,JCTiggs,1 month ago,1510997174473,"""My plan is to threaten as many countries as possible so they will feel the need to buy a HUGE amount of our wonderful weapons, which I may add are ALL made in the USA, so we make BIGLY money! KFC, so delicious. JOBS!"" 
- Donald J Trump",3,true,2,,,,,,,/Positive/,Positive,0.971
,,,,,,,,UgwpnLIpagv1e2e2jFh4AaABAg.8_0M9yASlZt8_0N7gtMnvv,Lar M,1 month ago,1510997175103,Selling dirt cheap 6th hand weapons to other countries and let them make the attack first. Don't you Leftists have any brains ????,0,/Negative/,Negative,0.658
,,,,,,,,UgwpnLIpagv1e2e2jFh4AaABAg.8_0M9yASlZt8_0OFQBAKso,humboldthammer,1 month ago,1510997175106,"Trump is the False Prophet (false profit).    Xi is the dragon. (Nixon, spelled inside out, is Xionn) And Putin is  PUT IN charge of the  2nd beast in Daniel 7: 5.   (arise devour much flesh) 
     We are about to be tricked into the war that proves most men are unfit for God's Kingdom -- IS i vs I AM vs URN't -- unless we Overcome. 03/22/2030 is the Beginning of the 3rd, 1000-year day of Heaven since Jesus taught us the Brotherhood of ALL Men. We are told He comes SOONER. and 1,260 days sooner, is just after the autumn equinox of the Illuminati's 250th year (1776-2026).   
      They have a Jubilee planned to forgive our huge war-debt -- as all the people cry out, ""No more war. Save us. We will do Anything!""   The Art of the Deal  step 4: Make them pay for what they want. Especially,  if you got them by the balls.  Trump said, ""I am the only one who can save you.""",0,/Negative/,Negative,0.527
Ugw_v2Q5j-ECWuaoJQx4AaABAg,Clara Sheeran,1 month ago,1510997174483,So why are we going to sell the weapons that will destroy us,2,true,1,,,,,,,/Negative/,Negative,0.896
,,,,,,,,Ugw_v2Q5j-ECWuaoJQx4AaABAg.8_0M9tW_DOL8_0N3GaiAbC,Donald Trump,1 month ago,1510997174990,its a very old business... very old....,0,/Positive/,Positive,0.891
UgxUqhjOle6bQFh0nV54AaABAg,marlonious76,1 month ago,1510997174491,Buy our weapons or we'll sell them to your enemies.,5,true,1,,,,,,,/Positive/,Positive,0.5
,,,,,,,,UgxUqhjOle6bQFh0nV54AaABAg.8_0M9QtvPsv8_0NNyO9bnM,Lar M,1 month ago,1510997175110,This has been happening since the end of WWII by all level and political parties in the country.Haven't you read history ?,0,/Positive/,Positive,0.611
UgzqnLAuKDahmvhfBi14AaABAg,Lar M,1 month ago,1510997174500,Why not ? Sell to these countries third and fourth hands obsolete weapons to make sure victory is certain. Young turd again. No brainers.,0,true,1,,,,,,,/Negative/,Negative,0.758
,,,,,,,,UgzqnLAuKDahmvhfBi14AaABAg.8_0M4tbmmew8_0P9xPP0BM,humboldthammer,1 month ago,1510997175115,"The devil wants the world well-armed for the war that proves most men unfit for God's Kingdom -- IS i vs I AM vs URN't.  Exercise faith to get in shape for the Awakening because only those with spirit capacity will ""see"" the Ancient of Days set final judgement on the devil and dragon (Daniel 7: 9-14)
      Trump is the False Prophet (false profit).    Xi is the dragon. (Nixon, spelled inside out, is Xionn) And Putin is  PUT IN charge of the  2nd beast in Daniel 7: 5.   (arise devour much flesh) 
     If Alex Jones had succeeded in summoning 1,000 demons to help, then things would look very different today.  But as soon as the demons awoke, the Most High immediately dispatched 250,000 angel Pair to remove every demon from Earth as of 5 AM election days over a year ago,  If you don't believe me, just try summoning a demon today.  Of course Jones did not really believe he could summon demons -- he was merely following instructions.",0,/Negative/,Negative,0.553
Ugz6TtwcoGLkfhmEbAR4AaABAg,ANony Mouse,1 month ago,1510997174508,Death = $$$   .. Thats America .. Biggest exporter of death .. Proud USA?,5,true,1,,,,,,,/Negative/,Negative,0.682
,,,,,,,,Ugz6TtwcoGLkfhmEbAR4AaABAg.8_0LnzeXplM8_0QgB7qhCP,thatdudewhoknosthatbrowhoknosthatguy,1 month ago,1510997175097,ANony Mouse theyre psychopaths they dont give af bro....,0,/Negative/,Negative,0.998
UgxmvnUguzg9FTjlSbl4AaABAg,youteub akount,1 month ago,1510997174519,"@Amberia Allen: Some americans and europeans believe that giving more power to big corporations will help them somehow. They don't realize they're cucking themselves from their own rights, or they don't care. They enjoy being enslaved, and they want you to be the same.",2,false,0,,,,,,,/Positive/,Positive,0.738
UgwgjvwooLYhE8wZool4AaABAg,AlbanZap,1 month ago,1510997174525,"TYT have gotten this story so wrong, purely for having no knowledge about this and just stoking their 'isn't Trump an idiot' train. Until recently, Vietnam was embargoed to buy US military technology, Obama lifted the embargo seeing Vietnam as a promising future military market (they spent $2bn on ships last year). Selling Vietnam military equipment is not only likely, it seems that they're more interested in military technology sharing. Securing the S. China sea is a major goal.",1,true,3,,,,,,,/Negative/,Negative,0.885
,,,,,,,,UgwgjvwooLYhE8wZool4AaABAg.8_0LRoKHWFh8_0LsvE6MM6,Da Sa,1 month ago,1510997175143,"But to be fair, Trump can't even do regular things (which are still actually debatable in their benefit) without looking like a moron.",0,/Negative/,Negative,0.887
,,,,,,,,UgwgjvwooLYhE8wZool4AaABAg.8_0LRoKHWFh8_0Ose10LDo,dancinkindofguy,1 month ago,1510997175145,AlbanZap TYT gets EVERY story wrong.   They make em fit their regressive narrative,0,/Negative/,Negative,0.506
