,,,,,,,,,,,,,,Classification path,Level 1 label,Level 1 probability
Ugzo-znXrfckzJXKy9h4AaABAg,Marx Dent,4 weeks ago,1510772490342,"I think I caught a glimpse of something here ... (naw grandpa's in trouble too, because HE KNOWS MORE than we do...)",0,false,0,,,,,,,/Negative/,Negative,0.5
UgyiI_fKGIC2KpKf5cF4AaABAg,WikeddTung,4 weeks ago,1510772490344,"I think this is much ado about nothing. An old man pinched the ass of a young woman. It happens. She can live a full, rich meaningful life despite the horrific trauma. Nobody has a right to ""touch"" anybody else. Every day all over the world people are killed in wars, murder, accidents, etc. Having your ass grabbed isn't the end of the world.",2,false,0,,,,,,,/Positive/,Positive,0.688
Ugyr29rr66q2bdz5VNh4AaABAg,Sorry But Not Sorry,4 weeks ago,1510772490347,All republican voters should be investigated for child molestation.,5,true,1,,,,,,,/Negative/,Negative,0.887
,,,,,,,,Ugyr29rr66q2bdz5VNh4AaABAg.8Zxc6PvNytH8Zxi-tP6ZXT,Max,4 weeks ago,1510772490828,It isn't molestation the second YOU took that 20 dollar bill!!,0,/Negative/,Negative,0.982
Ugwgo8t7RRT6KFk9jzV4AaABAg,Red Blaze,4 weeks ago,1510772490352,"This guy was involved in having JFK killed, and he got away with it. So of course he could get away with groping underaged girls!",4,false,0,,,,,,,/Negative/,Negative,0.836
UgyOeysbKZVtReT8OPV4AaABAg,Aye Now,4 weeks ago,1510772490355,"This just in, Ana once again overreacts to an everyday situation to play the part or liberal feminist. SMH. I can’t even take you seriously. Everyone has an old man in the family that does this.  Just roll him to the next room. Save the liberal outrage for things that matter, like money and politics.  Once again Cenk is the voice of reason.",8,false,0,,,,,,,/Negative/,Negative,0.787
UgyH8MDG9adtQs4nCVB4AaABAg,Albertus Vergilius,4 weeks ago,1510772490358,"Cenk is trying to have a nuanced opinion, but feminism is not compatible with nuance. Ana just wants to feel like a victim because her ass was squeezed once and she still gets wet thinking about it.",4,true,6,,,,,,,/Negative/,Negative,0.959
,,,,,,,,UgyH8MDG9adtQs4nCVB4AaABAg.8Zxb-f1RPjc8ZxdiPIz5uv,Don,4 weeks ago,1510772490790,Kill yourself.,0,/Negative/,Negative,0.971
,,,,,,,,UgyH8MDG9adtQs4nCVB4AaABAg.8Zxb-f1RPjc8Zxf1Cx9go5,Jennifer T.,4 weeks ago,1510772490793,"Amazingly, male douchebaggery is inconsistent with rational thought, basic humanity and a tolerable personality.",1,/Negative/,Negative,0.936
,,,,,,,,UgyH8MDG9adtQs4nCVB4AaABAg.8Zxb-f1RPjc8Zxhfa2KcuL,Albertus Vergilius,4 weeks ago,1510772490795,Did your ass gets squeezed too hun?,2,/Negative/,Negative,0.998
,,,,,,,,UgyH8MDG9adtQs4nCVB4AaABAg.8Zxb-f1RPjc8ZxlTJFHLH9,Jennifer T.,4 weeks ago,1510772490798,Thanks for proving my point.,1,/Positive/,Positive,0.998
,,,,,,,,UgyH8MDG9adtQs4nCVB4AaABAg.8Zxb-f1RPjc8ZyBmvf5uTL,JV Cooperative,4 weeks ago,1510772490800,What Bush did about taxes has nothing to do with this situation.,0,/Negative/,Negative,0.998
,,,,,,,,UgyH8MDG9adtQs4nCVB4AaABAg.8Zxb-f1RPjc8_-pbyWw9Xg,Albertus Vergilius,3 weeks ago,1511377290803,Can I squeeze it?,0,/Neutral/,Neutral,0.998
UgzIujaCxYeTfnaaQj14AaABAg,scorpion32,4 weeks ago,1510772490362,Bbbbbbut Trump & RUSSIA RUSSIA RUSSIA,3,false,0,,,,,,,/Neutral/,Neutral,0.758
UgzqLDxUd9DAd7yJqid4AaABAg,crypt keeper 071,4 weeks ago,1510772490364,79? Doesn't even know where is right this off to dementia.   Leave him along.   What kind of asshole would attack a man his age.   At 80 I am sure he has no interest in sex.,2,true,4,,,,,,,/Negative/,Negative,0.932
,,,,,,,,UgzqLDxUd9DAd7yJqid4AaABAg.8ZxZBNtwVSp8Zx_1CPLeVN,Don,4 weeks ago,1510772490746,"He jumped out of an airplane on his 80th birthday, Trumptard.",4,/Negative/,Negative,0.889
,,,,,,,,UgzqLDxUd9DAd7yJqid4AaABAg.8ZxZBNtwVSp8Zx_4cByrKZ,ScreamingForClemency,4 weeks ago,1510772490748,he's probably been doing this for decades. let's see if the timeline continues to get pushed back. wouldn't surprise me one bit.,3,/Negative/,Negative,0.889
,,,,,,,,UgzqLDxUd9DAd7yJqid4AaABAg.8ZxZBNtwVSp8Zy718PIfbc,crypt keeper 071,4 weeks ago,1510772490750,"Don 
No his family pushed him and I hate Trump.   What an insult,  trumptard indeed.",0,/Negative/,Negative,0.996
,,,,,,,,UgzqLDxUd9DAd7yJqid4AaABAg.8ZxZBNtwVSp8ZyBrVt1zTr,JV Cooperative,4 weeks ago,1510772490753,Sexual assault isn't about sex.,0,/Negative/,Negative,0.912
UgyTASoa-p3N2Y_dudZ4AaABAg,fischkopp1234,4 weeks ago,1510772490368,"Wait, what?? Someone groped Ana's ass? So ... uh ... how did it feel, Cenk?",3,true,4,,,,,,,/Neutral/,Neutral,0.9
,,,,,,,,UgyTASoa-p3N2Y_dudZ4AaABAg.8ZxZ-AskD0F8ZxaTaS7tdW,Albertus Vergilius,4 weeks ago,1510772490814,"He said it was very firm, probably implants",2,/Positive/,Positive,0.938
,,,,,,,,UgyTASoa-p3N2Y_dudZ4AaABAg.8ZxZ-AskD0F8ZxpH0Xu83S,Cenk Uyger,4 weeks ago,1510772490816,Albertus Vergilius   I prefer Johns.,1,/Positive/,Positive,0.998
,,,,,,,,UgyTASoa-p3N2Y_dudZ4AaABAg.8ZxZ-AskD0F8Zxqjj4J5cD,Albertus Vergilius,4 weeks ago,1510772490820,lmao,0,/Neutral/,Neutral,0.998
,,,,,,,,UgyTASoa-p3N2Y_dudZ4AaABAg.8ZxZ-AskD0F8Zy0noOjMOG,fischkopp1234,4 weeks ago,1510772490822,"Must've been a hard time, when John was away touring Antarctica, huh?",0,/Negative/,Negative,0.85
UgxQJPeNIyJESqyESLh4AaABAg,Steven Carleton,4 weeks ago,1510772490373,What about creepy joe Biden.  There’s plenty of videos and photos of him with little kids and peoples wives groping them up,2,true,1,,,,,,,/Positive/,Positive,0.826
,,,,,,,,UgxQJPeNIyJESqyESLh4AaABAg.8ZxYdj1MyzA8ZxaKrKIq75,Justin Quinn,4 weeks ago,1510772490688,Typical whataboutism. Both should be thrown in prison.,0,/Negative/,Negative,0.99
UgyuSdRFotas5ogta5h4AaABAg,D Mc,4 weeks ago,1510772490376,The awareness of this is fairly recent. These kind of things used to be viewed as funny.,1,true,1,,,,,,,/Positive/,Positive,0.807
,,,,,,,,UgyuSdRFotas5ogta5h4AaABAg.8ZxY-S8qjTk8ZxZgsj5cmz,Don,4 weeks ago,1510772490733,I doubt the groped women ever viewed them as funny.,1,/Positive/,Positive,0.506
Ugw5NRV7u3yac2wDAgV4AaABAg,Andi Amador,4 weeks ago,1510772491784,"I gave Bush Sr. a potential pass for the recent ones because he is in his nineties and he appears to be compromised himself. Was he in the chair and cognitively slipping back in 2003? 
Did the accuser from 2003 relate that he stated the 'cop a feel' joke during that incident?",0,false,0,,,,,,,/Negative/,Negative,0.549
UgznJaY9eaf--7hUWMd4AaABAg,se7en,4 weeks ago,1510772491787,Look into pizzagate. Dont dismiss elite pedos. Example THIS VIDEO,2,true,2,,,,,,,/Neutral/,Neutral,0.762
,,,,,,,,UgznJaY9eaf--7hUWMd4AaABAg.8ZxXNSXYHrr8ZxY1EHzJQm,D Mc,4 weeks ago,1510772492470,LOL! You're a kook.,3,/Positive/,Positive,0.99
,,,,,,,,UgznJaY9eaf--7hUWMd4AaABAg.8ZxXNSXYHrr8ZxfGOLQeFd,Jennifer T.,4 weeks ago,1510772492475,"You are a year late on that one. Even Alex Jones has backed away from his manufactured ""Pizzagate"" conspiracy.",1,/Negative/,Negative,0.807
UgyHEIAgkRSjZ94WCi94AaABAg,HScarlet,4 weeks ago,1510772491791,"Man, what is it with republicans and kids, and grabbing women up. And why are the deplorable pied piper right defending them all the time.

You wouldn't believe the republicans impeached Clinton for what he did, that's like everyday behavior for these guys.",3,true,2,,,,,,,/Negative/,Negative,0.787
,,,,,,,,UgyHEIAgkRSjZ94WCi94AaABAg.8ZxXN7PogFi8ZxbHXTpmUF,Albertus Vergilius,4 weeks ago,1510772492358,"And Democrats don't do the same? Bill Clinton, Weiner, Weinstein... Guess you forgot some people in your comment dipshit",1,/Negative/,Negative,0.799
,,,,,,,,UgyHEIAgkRSjZ94WCi94AaABAg.8ZxXN7PogFi8ZxfcSjvcby,Jennifer T.,4 weeks ago,1510772492362,"Albertus, you just proved HScarlet's point.  Clinton, Weiner and Weinstein were all busted and disgraced for their bad behavior.  The only difference, I can see, is that when a republican does it, all the other cons rush to his defense to make excuses and to try to abuse and discredit the accusers.",0,/Positive/,Positive,0.492
UgySl5sBy2PQUGO3qk94AaABAg,GR. Hollman,4 weeks ago,1510772491795,"Yes Cenk, go out of your way to defend Republicon Bush sexually molesting young girls then slant the truth or lie to bash Democrats. What kind of a duplicitous ""Progressive"" are you not?",4,true,7,,,,,,,/Negative/,Negative,0.414
,,,,,,,,UgySl5sBy2PQUGO3qk94AaABAg.8ZxWQke4Dom8ZxY4qik6kZ,Don,4 weeks ago,1510772492250,"Watch his video defending Louis C.K. the other night, which is even worse.  The 2 women in the video with him were so disgusted they wouldn't even look at him, and he was oblivious.",0,/Negative/,Negative,0.965
,,,,,,,,UgySl5sBy2PQUGO3qk94AaABAg.8ZxWQke4Dom8ZxZAYSGfPz,GR. Hollman,4 weeks ago,1510772492254,"+Don 
I didn't see it, I will look for it. Cenk is not a progressive, he's a shill Republicon pandering to confuse the vulnerable left viewers to Sink there vote. Cenk started this show with 3 then an additional 30 million of Republicon Wall Street financial backing. The papers were filed in 2009 or 2008. Where has the Wolf PAC money gone? Look at the candidates, most are bad candidates not just mediocre. Wake Up People!",1,/Negative/,Negative,0.918
,,,,,,,,UgySl5sBy2PQUGO3qk94AaABAg.8ZxWQke4Dom8ZxbY_YUyA0,Albertus Vergilius,4 weeks ago,1510772492258,"You are a moron, and a perfect example of what's wrong with the left. Cenk is presenting a nuanced opinion taking into account other factors but moron neanderthal liberals just want to think in black and white. It's as though Libs are allergic to truth, it is fascinating.",1,/Negative/,Negative,0.65
,,,,,,,,UgySl5sBy2PQUGO3qk94AaABAg.8ZxWQke4Dom8ZxdeqwVV9K,Don,4 weeks ago,1510772492261,"Albertus Trumptard, I'm sure Cenk is thrilled to appeal to the likes of you.",0,/Negative/,Negative,0.639
,,,,,,,,UgySl5sBy2PQUGO3qk94AaABAg.8ZxWQke4Dom8ZxhZm3aS4l,Albertus Vergilius,4 weeks ago,1510772492266,Yeah and im sure he is thrilled to be on the other side of Philistine libtards like yourself,1,/Positive/,Positive,0.969
,,,,,,,,UgySl5sBy2PQUGO3qk94AaABAg.8ZxWQke4Dom8ZxiRaIRJDb,GR. Hollman,4 weeks ago,1510772492269,"+Albertus Vergilius 
You lend further evidence to this duplicitous con job. You're a Trump Republicon supporting Cenk.",1,/Positive/,Positive,0.988
,,,,,,,,UgySl5sBy2PQUGO3qk94AaABAg.8ZxWQke4Dom8Zxio_DQtTA,Albertus Vergilius,4 weeks ago,1510772492273,"This is exactly what I mean, Libs only see in black and white. Thanks for proving my point. Either you're a libtard or a Trump supporter. believe it or not there is a middle ground known as ""thinking adults""",1,/Positive/,Positive,0.926
UgxIf2WNP9VCKks0gad4AaABAg,Plastic Altar,4 weeks ago,1510772491800,The West for the Whites. ONLY Whites.,3,true,3,,,,,,,/Positive/,Positive,0.791
,,,,,,,,UgxIf2WNP9VCKks0gad4AaABAg.8ZxW9XEpdDt8ZxpSMhgzng,Cenk Uyger,4 weeks ago,1510772492338,Plastic Altar    No Jews either.,1,/Negative/,Negative,0.998
,,,,,,,,UgxIf2WNP9VCKks0gad4AaABAg.8ZxW9XEpdDt8ZyCJg4dYrw,JV Cooperative,4 weeks ago,1510772492342,"Thank you for the thoughtful and relevant comment, troll.",1,/Positive/,Positive,0.998
,,,,,,,,UgxIf2WNP9VCKks0gad4AaABAg.8ZxW9XEpdDt8ZyDbpB6t8P,Plastic Altar,4 weeks ago,1510772492346,Who are you? Don't type in my comments if you're not bright enough to agree with me. Filth.,0,/Negative/,Negative,0.514
UgylU8LbW1eO8HL7OCt4AaABAg,hannermax,4 weeks ago,1510772491803,"Cenk, WTF",6,false,0,,,,,,,/Negative/,Negative,0.906
UgxlbQSDnRdxXW8LGCl4AaABAg,Greg K,4 weeks ago,1510772491806,I’m suing myself for groping myself last night,3,false,0,,,,,,,/Neutral/,Neutral,0.848
UgwY18ULMyJumXHNf2V4AaABAg,crypt keeper 071,4 weeks ago,1510772491812,"Believable,  have you seen Barbara?",0,false,0,,,,,,,/Neutral/,Neutral,0.57
Ugzdj_bUbpGbbE4gHch4AaABAg,Vbbymcr,4 weeks ago,1510772491814,"Ex president or not, an old wheelchair man grabs my ass he’s getting punched. And will be hearing from my lawyer, bet that old creep wouldn’t touch another girl again . He never received any consequences and that’s why he keeps doing it.",4,false,0,,,,,,,/Negative/,Negative,0.768
Ugxywlos1dQvhgMnqLl4AaABAg,Todd McPeak,4 weeks ago,1510772491818,"Biden 2020. He'd never grope an underage girl.
Ok, the slogan could maybe use some work. But I defy anyone to produce evidence of Joe Biden being anything other than the very best vice president this nation has ever had. C'mon Joe, please run. If only you had run instead of Hillary, uncle Joe.",1,true,5,,,,,,,/Negative/,Negative,0.52
,,,,,,,,Ugxywlos1dQvhgMnqLl4AaABAg.8ZxUUQdDDtO8ZxV8aieeOp,Justin Case,4 weeks ago,1510772492392,"Creepy Biden/Rape Clinton 2020! Rape the WhiteHouse!!!

Todd! Your sarcasm has me dying over here! great stuff bro!",1,/Positive/,Positive,0.898
,,,,,,,,Ugxywlos1dQvhgMnqLl4AaABAg.8ZxUUQdDDtO8ZxVw6H0mGD,Ski Czar,4 weeks ago,1510772492398,Biden? Really? Gtfo.,2,/Negative/,Negative,0.998
,,,,,,,,Ugxywlos1dQvhgMnqLl4AaABAg.8ZxUUQdDDtO8ZxXhCfSOOy,Don,4 weeks ago,1510772492401,He's a war mongering neocon who was recently winking at racists in Alabama by talking about how great everything was in the Senate back in the days of the old southern segregationists.  He even imitated one of them for laughs.,2,/Positive/,Positive,0.936
,,,,,,,,Ugxywlos1dQvhgMnqLl4AaABAg.8ZxUUQdDDtO8ZxaiCjJSs3,Justin Quinn,4 weeks ago,1510772492405,"Beto O'Rourke 2020. True Progressive, no Super PAC money, will be 48 years old,  going to unseat Lyin' Ted Cruz.",1,/Neutral/,Neutral,0.477
,,,,,,,,Ugxywlos1dQvhgMnqLl4AaABAg.8ZxUUQdDDtO8ZyCV0szKl7,JV Cooperative,4 weeks ago,1510772492408,"He supports the TPP, for starters.  Back with the centrists you go.",0,/Positive/,Positive,0.918
Ugz2FXf9JUJtLnB_oTd4AaABAg,Tatersalad19 Cars,4 weeks ago,1510772491822,Bugs bunny just made allegations of sexual misconduct against Elmer Fudd,6,false,0,,,,,,,/Positive/,Positive,0.475
UgxxRv5BS9qlE9bWgRR4AaABAg,Duncan Kuhns,4 weeks ago,1510772491826,What Bush did was clearly wrong but really...people (including Ana) are over-reacting to this.,3,true,2,,,,,,,/Negative/,Negative,0.998
,,,,,,,,UgxxRv5BS9qlE9bWgRR4AaABAg.8ZxUISZipaI8ZxaYtcV4to,Aye Now,4 weeks ago,1510772492304,Duncan Kuhns exactly,1,/Positive/,Positive,1
,,,,,,,,UgxxRv5BS9qlE9bWgRR4AaABAg.8ZxUISZipaI8ZyCa4_huQg,JV Cooperative,4 weeks ago,1510772492308,He's a serial groper and a war criminal.  He's gotten a lot less than he deserves.,0,/Positive/,Positive,0.717
UgwcN7xVQtJt5_3rSn14AaABAg,BM,4 weeks ago,1510772491830,"He's old, he's lost some faculties, people have to chill out. Those who take care of him need to control him, make him understand how wrong he is, make him stop, but this isn't harassment, this is the behaviour of an old man who's no longer himself. If this is his normal self, we'll start seeing women accusing him of misconduct when he was younger and fully responsible for his acts. Until then, I won't see this as harassment but as an age-related mental issue.",4,true,3,,,,,,,/Negative/,Negative,0.834
,,,,,,,,UgwcN7xVQtJt5_3rSn14AaABAg.8ZxU4n7HPJS8ZxUvmu1n5K,Vbbymcr,4 weeks ago,1510772492511,BM he knows wtf he’s doing,2,/Positive/,Positive,0.77
,,,,,,,,UgwcN7xVQtJt5_3rSn14AaABAg.8ZxU4n7HPJS8ZxYINboGLb,Kras Reese,4 weeks ago,1510772492517,"BM 
I hear ya..!!!",0,/Neutral/,Neutral,0.865
,,,,,,,,UgwcN7xVQtJt5_3rSn14AaABAg.8ZxU4n7HPJS8ZyCbIRcYM_,JV Cooperative,4 weeks ago,1510772492520,This was from 2003.,0,/Positive/,Positive,0.648
UgzuolUu2WhBofZlmmh4AaABAg,Sara Nemecek,4 weeks ago,1510772491835,I have to say ... I have never touch a person that didnt invite me to do so... Maybe its no big deal to some ... But its not okay to put your hands on people... You cant even touch strippers... What the hell makes these people who are supposed to be highly educated and in positions of power they should know better,6,true,1,,,,,,,/Negative/,Negative,0.963
,,,,,,,,UgzuolUu2WhBofZlmmh4AaABAg.8ZxU2adPtzF8ZyCdu0nuFZ,JV Cooperative,4 weeks ago,1510772492201,It's called being a psychopath.,0,/Negative/,Negative,0.996
Ugyzobu1MHYiI1KAoHF4AaABAg,amy jenkins,4 weeks ago,1510772491839,F A K E    N E W S    A N  T I  -   W H I T E         P R O P A G A N D A,5,true,2,,,,,,,/Positive/,Positive,0.627
,,,,,,,,Ugyzobu1MHYiI1KAoHF4AaABAg.8ZxU-RdjN358ZxW2Ov7Clj,iamtheilluminatiify,4 weeks ago,1510772492222,W H I T E  G E N O C I D E,0,/Neutral/,Neutral,0.963
,,,,,,,,Ugyzobu1MHYiI1KAoHF4AaABAg.8ZxU-RdjN358ZyCfFryJZj,JV Cooperative,4 weeks ago,1510772492225,Greatest comment ever.,0,/Positive/,Positive,0.998
UgwIBmYFA5_ILJQsRHB4AaABAg,Alex Andreas,4 weeks ago,1510772491843,The dude is about to die soon!!! Way to late girls...... u should of confessed before the first gulf war,6,true,2,,,,,,,/Positive/,Positive,0.67
,,,,,,,,UgwIBmYFA5_ILJQsRHB4AaABAg.8ZxTFumCmAv8ZxYSFGaVh0,Kras Reese,4 weeks ago,1510772492319,"Alex Andreas 
Lol!",1,/Neutral/,Neutral,0.729
,,,,,,,,UgwIBmYFA5_ILJQsRHB4AaABAg.8ZxTFumCmAv8Zxc-2t-x6Y,run away pacman!,4 weeks ago,1510772492322,your too funny,0,/Positive/,Positive,0.711
Ugyg0W-Nf3LFwWoUvHh4AaABAg,IMC IMC,4 weeks ago,1510772491848,look up: VP Creepy Joe Biden Caught Groping Young Girls On Camera,3,true,1,,,,,,,/Neutral/,Neutral,0.938
,,,,,,,,Ugyg0W-Nf3LFwWoUvHh4AaABAg.8ZxT6F1bPH38ZxVVicBmmy,Todd McPeak,4 weeks ago,1510772492370,"What is this asshole sayin?? Don't you dare go looking up creepy uncle joe videos. It's all fake news. The russians and the photoshop and whatnot. i think snopes debunked that already. Uncle Joe is the hope for the Democratic party, the Today Show told me so just yesterday. Would Matt Lauer lie?? Savannah Guthrie, that's some real news there. Trust Matt and Savannah. And don't look up Creepy Uncle Joe!!!",0,/Negative/,Negative,0.844
UgxUoKpH8kxCPlVB1YZ4AaABAg,Bernadette Hurst,4 weeks ago,1510772491852,"Sorry, but an old man doing a ""cop-a-feel"" joke is kind of funny. If you're emotionally scarred from being the ""butt"" of the joke, then there was something wrong with you to begin with. ...and I'm a liberal.",6,true,6,,,,,,,/Negative/,Negative,0.986
,,,,,,,,UgxUoKpH8kxCPlVB1YZ4AaABAg.8ZxSe6Ff2fp8ZxXuyZ596d,Don,4 weeks ago,1510772492431,"You're not fooling anybody, Trumptard.",1,/Negative/,Negative,0.998
,,,,,,,,UgxUoKpH8kxCPlVB1YZ4AaABAg.8ZxSe6Ff2fp8ZxbIqkZu7t,Bernadette Hurst,4 weeks ago,1510772492436,Don LOL! I was a volunteer on the Bernie campaign. I just think that there's a huge difference between a little joke and sexual harassment/assault. Let's not lose our minds over the small stuff!,2,/Negative/,Negative,0.789
,,,,,,,,UgxUoKpH8kxCPlVB1YZ4AaABAg.8ZxSe6Ff2fp8ZxclIJ6CJA,Albertus Vergilius,4 weeks ago,1510772492439,"Groping a 16 year old is really not okay. I have been groped by some older women in my family, around that same age, and it did make me uncomfortable. I think what Ana is saying is justified, ""keep your hands to yourself"" - That said, we don't need to send him to the Gulag over it. We can use it as a moment for education and move along. Not sure what Ana and her feminist friends hope to accomplish with their outrage.",2,/Positive/,Positive,0.465
,,,,,,,,UgxUoKpH8kxCPlVB1YZ4AaABAg.8ZxSe6Ff2fp8ZxmxqoLsh8,Don,4 weeks ago,1510772492443,"OK Bernadette, if I ever see you and think you're attractive, I'll take that as permission to fondle your ass.",2,/Positive/,Positive,0.545
,,,,,,,,UgxUoKpH8kxCPlVB1YZ4AaABAg.8ZxSe6Ff2fp8ZyO7r5O2fO,Bernadette Hurst,4 weeks ago,1510772492448,Don You still don't see the difference between a joke and assault. Maybe you need to work on your sense of humor.,1,/Negative/,Negative,0.988
,,,,,,,,UgxUoKpH8kxCPlVB1YZ4AaABAg.8ZxSe6Ff2fp8ZyPALA49j7,Don,4 weeks ago,1510772492453,"I didn't say it was an assault Bernadette.  It is very inappropriate, not something to laugh about.  You're suggesting it is OK for old men to grope the rear ends of young girls, which is very strange for a woman and/or a liberal to say.",1,/Negative/,Negative,0.779
UgyQu2OfIpVn1hHv2Bt4AaABAg,Mike C,4 weeks ago,1510772491858,"The man is on his deathbed, so this is way to late to do anything about...",4,true,1,,,,,,,/Negative/,Negative,0.943
,,,,,,,,UgyQu2OfIpVn1hHv2Bt4AaABAg.8ZxSaKb9yMY8ZyCurqN6WN,JV Cooperative,4 weeks ago,1510772492487,"Yes, but at least his legacy can be destroyed.",0,/Positive/,Positive,0.676
UgzqEo4NR1OfAXjKOQ94AaABAg,Blackatchaproduction,4 weeks ago,1510772491862,"Wonder if there will be a plethora of memes about all these ""white"" child molesters. Or if they will actually get taken in and out of court",2,true,10,,,,,,,/Negative/,Negative,0.557
,,,,,,,,UgzqEo4NR1OfAXjKOQ94AaABAg.8ZxRpoRGMqw8ZxSSaVIKty,Dragon1717,4 weeks ago,1510772492550,"However, the lion's share of child molestation occurs in the urban communities.",3,/Positive/,Positive,0.441
,,,,,,,,UgzqEo4NR1OfAXjKOQ94AaABAg.8ZxRpoRGMqw8ZxTA_0PtMr,Blackatchaproduction,4 weeks ago,1510772492553,"Dragon1717 how far up your ass did you reach for that bullshit? Never mind, you're a troll. So you won't actually have an answer nor any facts",0,/Negative/,Negative,0.994
,,,,,,,,UgzqEo4NR1OfAXjKOQ94AaABAg.8ZxRpoRGMqw8ZxTJHcvIIY,Mike C,4 weeks ago,1510772492556,"That's because most people in positions of power are white and not because 
white people are a bunch of peds...",0,/Negative/,Negative,0.986
,,,,,,,,UgzqEo4NR1OfAXjKOQ94AaABAg.8ZxRpoRGMqw8ZxThL4uazC,Blackatchaproduction,4 weeks ago,1510772492559,"Mike C ""white"" people aren't a bunch of pedos? Could have fooled me and the rest of indigenous humanity",0,/Negative/,Negative,0.992
,,,,,,,,UgzqEo4NR1OfAXjKOQ94AaABAg.8ZxRpoRGMqw8ZxUDaDVM42,Mike C,4 weeks ago,1510772492563,"Blackatchaproduction 
That's like saying blacks are a bunch of homicidal maniacs. 
Because they are responsible for the majority of homicides. 
Though I don't attribute this to backs being pathological.",0,/Negative/,Negative,0.992
,,,,,,,,UgzqEo4NR1OfAXjKOQ94AaABAg.8ZxRpoRGMqw8ZxUouzf_ul,Blackatchaproduction,4 weeks ago,1510772492567,"Mike C too bad when we look at reality of the situation. And actual recorded events over years and years of time. We see ""white"" people powerful or not, engaged with some form of pedophilia. From trips to Asian countries to soldiers going overseas. You guys even let cops off for being pedos",0,/Negative/,Negative,0.641
,,,,,,,,UgzqEo4NR1OfAXjKOQ94AaABAg.8ZxRpoRGMqw8ZxV96ovO5j,Slawischstreiter,4 weeks ago,1510772492570,"+ Blackatchaproduction

Muslims are the biggest pedos right now. At least in white countries it's illegal. Over there you can marry a 12 year old and rape your wife all you want.",0,/Negative/,Negative,0.818
,,,,,,,,UgzqEo4NR1OfAXjKOQ94AaABAg.8ZxRpoRGMqw8ZxWFHILPyL,Blackatchaproduction,4 weeks ago,1510772492575,"Slawischstreiter it being illegal stopped ""white"" people from doing it? So making it illegal is just to try and save face or put on a facade?",0,/Negative/,Negative,0.969
,,,,,,,,UgzqEo4NR1OfAXjKOQ94AaABAg.8ZxRpoRGMqw8ZxWVqIDm9P,Mike C,4 weeks ago,1510772492580,"Blackatchaproduction see your generalizations show your racial biases. 
Stereotyping a race based on a minority of them is disingenuous.
Also saying ""you guys even let cops off for being peds""
Is also ridiculous as government has been usurped by the rich and 
Powerful corporate world and police and correction unions are used to pacify 
and protect from accountability..
But by all means fall in line with their polarization parody, of blaming demographics 
Instead of individuals. 
It may make you feel justified in your hate for whites but it will do nothing to solve 
social issues....",1,/Negative/,Negative,0.598
,,,,,,,,UgzqEo4NR1OfAXjKOQ94AaABAg.8ZxRpoRGMqw8ZxdsUr1Kgl,Slawischstreiter,4 weeks ago,1510772492583,"+Blackatchaproduction

Obviously it doesn't stop everyone, especially the rich and powerful from doing it but it's certainly a step up from doing it out in the open with no fear of legal repercussions if you are found out. It's also socially acceptable in many Muslim countries. Here they try their best to hide it when not around friends who share similar tastes.",0,/Positive/,Positive,0.979
UgwZvapV-3kzBvtI6hh4AaABAg,Betty Carruth,4 weeks ago,1510772493381,Geroge H W Bush Sr is a sex offended. Geroge H W Bush Sr. Is  laying. Geroge HW Bush Sr. Was tired of his wife looking older than his mother. Rape is rape murder is murder killing is killing,1,false,0,,,,,,,/Negative/,Negative,0.887
UgwPt6NfJ_B8vaSKokJ4AaABAg,Dave B,4 weeks ago,1510772493385,HW did invade panama and kill 3000 civilians running some over with tanks; putting them in camps and not letting them leave or give them food or water. He killed less then his son thats it.,1,true,1,,,,,,,/Negative/,Negative,0.99
,,,,,,,,UgwPt6NfJ_B8vaSKokJ4AaABAg.8ZxRhuJXTmz8ZyDasukjpT,JV Cooperative,4 weeks ago,1510772493920,Don't forget Iraq.,0,/Positive/,Positive,0.912
UgxjEw8gaAz_L-pF5N54AaABAg,Danica Lee,4 weeks ago,1510772493390,"The guy has done more than grope underage girls. Read Tranceformation of America by Cathy O'Brien which you can download for free online in PDF format (aka nobody is trying to make money off of anything). The guy is a straight up psychopathic monster straight from the depths of CIA/Nazi Hell.
Nazi mind control experiments did not end in Germany with the alleged fall of the Nazi party. Those brought here under Project Paperclip continued it, very successfully.",2,false,0,,,,,,,/Negative/,Negative,0.926
Ugz9iqSD460S5M20e2l4AaABAg,upabittoolate,4 weeks ago,1510772493395,"If he did it, he's an asshole. If she was 18, he's an asshole and an American hero. But don't go grabbing women without asking first. That's not funny.",2,true,2,,,,,,,/Negative/,Negative,0.98
,,,,,,,,Ugz9iqSD460S5M20e2l4AaABAg.8ZxRCnxe6Jx8ZxcxNEoOJt,Albertus Vergilius,4 weeks ago,1510772493823,"Even if he asked, it would be considered wrong - Louis CK asked and he is still under the bus because he is a guy and is considered to have ""power"". Asking is not really a question but a predicament in that case he said. The same would apply to Bush.",1,/Negative/,Negative,0.826
