,,,,,,,,,,,,,,Classification path,Level 1 label,Level 1 probability
,,,,,,,,UgwwwZut_lQPSbTf-Mx4AaABAg.8_0ty-NnwW-8_39O89xyYH,blinkin,1 month ago,1510997163030,"money is a method of trade and has no inherent value. adding money to an economy that already has a functioning currency system, provides very little if any benefit, just ask pre WW2 Germany. the US is among the richest countries in the world, BUT due to a corrupted form of capitalism resources are not being distributed properly.

money is only as valuable as the things it is traded for and when it simply sits in the bank accounts of billionaires it is completely worthless. when Trump rigs the tax system so that poor and middle class get wrung dry while giant corporations like oil and the weapons industry get a steady stream of government money it destabilizes the US and foments unrest.

it won't be my head on a pike but i would rather avoid an easily avoidable civil war.

Trump has only managed to bribe a few companies to come back to the US and then after they got the money they left anyway -> Carrier",1,/Negative/,Negative,0.973
,,,,,,,,UgwwwZut_lQPSbTf-Mx4AaABAg.8_0ty-NnwW-8_39hWu3tEN,8bitpothead,1 month ago,1510997163032,"Mob Flork

^ this is an example of a cuck",0,/Negative/,Negative,0.852
UgycXgTjgsMLQceBZBR4AaABAg,Douglas K. Young,1 month ago,1510997162464,"What happened to 'by the people, for the people'?",2,false,0,,,,,,,/Negative/,Negative,0.65
UgwjoJlaCCPzTQOgCZp4AaABAg,MR. Right,1 month ago,1510997162466,Where is Cenk?,1,false,0,,,,,,,/Negative/,Negative,0.996
UgxREyWD74tjkf1bf2t4AaABAg,MR. Right,1 month ago,1510997162470,Let’s boycott USA then it will collapse and hope the constitution will be reformed,4,true,6,,,,,,,/Neutral/,Neutral,0.451
,,,,,,,,UgxREyWD74tjkf1bf2t4AaABAg.8_0s2Ztalgl8_0sgN4qQ7d,Sven Kampen,1 month ago,1510997162862,Too late the US president is already boycottong the US.,4,/Neutral/,Neutral,0.604
,,,,,,,,UgxREyWD74tjkf1bf2t4AaABAg.8_0s2Ztalgl8_0tLUO59db,RYLCatalystic,1 month ago,1510997162864,"that statement makes no sense, you dont like the constitution then go find a country that you like their constitution.
you dont need to fix the one thing that is not broke, the broke part of all this is the politicians,cops. trying to stomp on your constitutional rights. 
instead of making remarks like you just did that has no merit, try to get people to sign on the dotted line for a ""no confidence"" vote for the crooked politicians.",0,/Negative/,Negative,0.98
,,,,,,,,UgxREyWD74tjkf1bf2t4AaABAg.8_0s2Ztalgl8_0vESPYKzk,Legate Alucard,1 month ago,1510997162867,Reformed doesn't mean disband,0,/Negative/,Negative,0.998
,,,,,,,,UgxREyWD74tjkf1bf2t4AaABAg.8_0s2Ztalgl8_3kXFHp3DN,RYLCatalystic,1 month ago,1510997162869,"so what does reformed mean to you. to me and everyone it means rewriting the constitution, which you cannot rewrite the constitution or the bill of rights, not without a revolution. so i am confused what you mean by reformed then.",1,/Negative/,Negative,0.82
,,,,,,,,UgxREyWD74tjkf1bf2t4AaABAg.8_0s2Ztalgl8_3zx1nn7DP,MR. Right,1 month ago,1510997162872,"RYLCatalystic well, it means improve it in a better moral way.",1,/Negative/,Negative,0.926
,,,,,,,,UgxREyWD74tjkf1bf2t4AaABAg.8_0s2Ztalgl8_4Pb84C4KW,RYLCatalystic,1 month ago,1510997162874,"does it now? well funny how some want to change something only to fit their wants but yet it is something that cannot be changed. like i said, if you dont like the constitution then go to another country that their constitution is one you can live with. no one is keeping you here.
like i said, you cannot change it unless you have a revolution. how about learning about it instead of trying to do something to it that cannot be done. 
and i will teach you something about morals. morals is a word that changes everyday according to how some think. and 2 persons can have different outtakes on what is moral. an example is back in the day it was alright and moral to stone people, but today says that stoning is not moral at all. but wait, some countries says it is alright still today. so who is right? lmao, 
if you read the constitution it is put in place so the government does not become a big government, learn about it and why the bill of rights was put in place and connot be changed. if you are wanting to change it, it would mean that you are for a big government.. if you dont like it then move to another country.
the issue with our government is not the constitution, it is fair and balanced, it is the ones that are running it that is ruining this country. now the people in the government can be reformed, meaning change the people in it just like Thomas Jefferson said. but that is another story in itself. bottom line is the people in government has become so corrupt and is not following what our founding fathers had put in place to protect the people right to be free.
i am neither republican nor democrat as both parties are really that stupid and radical about their thoughts. i am for the party of the CONSTITUTION OF THE USA. so who's side are you on?
and word of advice, a one sentence reply does not explain anything on your views. you are the type that at work complain all the time but yet have no solutions to the problems at hand. my employees cannot bitch about anything without having something of a fix to go with it. anything short of that is a waste of time in anybodies eyes. 
well, hope this covered all your angles. you was very short with your reply which could go a lot of different ways.",0,/Negative/,Negative,0.9
UgyLEORYqne5MJPrsGF4AaABAg,Ageust2,1 month ago,1510997162474,not a word about zimbabwe huh?,1,true,5,,,,,,,/Negative/,Negative,0.996
,,,,,,,,UgyLEORYqne5MJPrsGF4AaABAg.8_0qv10RlPI8_0rbQJ2Qqt,waterandafter,1 month ago,1510997162888,"Ageust2 
Tyt is not known for breaking news coverage.",2,/Negative/,Negative,0.998
,,,,,,,,UgyLEORYqne5MJPrsGF4AaABAg.8_0qv10RlPI8_0wT1_tgeC,8bitpothead,1 month ago,1510997162892,"yeah theyre always a day behind, if you want breaking you'll have to tune into the live shows",1,/Positive/,Positive,0.992
,,,,,,,,UgyLEORYqne5MJPrsGF4AaABAg.8_0qv10RlPI8_0xlhdqYk-,Araa G.,1 month ago,1510997162894,The youtube clips are the stories covered in the live show of the day before.,2,/Neutral/,Neutral,0.469
,,,,,,,,UgyLEORYqne5MJPrsGF4AaABAg.8_0qv10RlPI8_1-H4nGMFH,TheLumberjack1987,1 month ago,1510997162896,8bit they are recorded and uploaded a day after you slowpoke,0,/Positive/,Positive,0.727
,,,,,,,,UgyLEORYqne5MJPrsGF4AaABAg.8_0qv10RlPI8_1-fT64rYU,Name And Address Supplied,1 month ago,1510997162898,"They can't give you all the news that's happens in one sitting morons....If you think they should do better , go somewhere else you stupid fuckers...Whinge & complain and yet STILL visits the channel. No wonder most, if not all of us don't give a rat's arse what you people think at the end of the day.....What about the other channels, Have they reported on it and if so why aren't you there instead of here?  We know why you're here : You're special snowflakes who like to feel faux outrage thinking you can get away with your pathetic attempts. We can smell you lot from a mile away. LOLOLOL",2,/Negative/,Negative,0.965
Ugxwz41H3PWSuRKkTbl4AaABAg,shane gil,1 month ago,1510997162478,I saw that too..,2,false,0,,,,,,,/Neutral/,Neutral,0.945
Ugz1d3UDcx9igrPEP9x4AaABAg,Tony H,1 month ago,1510997162481,"Ana, youre still sick. Go home.",1,false,0,,,,,,,/Positive/,Positive,0.564
UgzZNXW6vEWiVKh-RaV4AaABAg,mtarkes,1 month ago,1510997162483,Whats hot on The view ladies?,1,false,0,,,,,,,/Positive/,Positive,0.986
UgwatPzzlqYgxs-xhCl4AaABAg,Tychoxi,1 month ago,1510997162486,"Like Barack ""Nobel Peace Prize"" Obama didn't peddle machines of war all over the world.",2,true,4,,,,,,,/Positive/,Positive,0.664
,,,,,,,,UgwatPzzlqYgxs-xhCl4AaABAg.8_0qLh3mCgM8_0uko4bQU6,Rockyblack smith,1 month ago,1510997162826,"And how does that make Trump doing it acceptable?
Whataboutism isn't an argument, it's a diversion tactic.
You got anything real to say?",3,/Negative/,Negative,0.885
,,,,,,,,UgwatPzzlqYgxs-xhCl4AaABAg.8_0qLh3mCgM8_1DOd9azBm,cne08,1 month ago,1510997162828,Obama ISN'T POTUS anymore Tychoxi.,1,/Negative/,Negative,0.977
,,,,,,,,UgwatPzzlqYgxs-xhCl4AaABAg.8_0qLh3mCgM8_1LkbKTLJi,Tychoxi,1 month ago,1510997162831,Rockyblack smith lol what I'm saying is this is normal US policy but it's treated here as something special,0,/Negative/,Negative,0.57
,,,,,,,,UgwatPzzlqYgxs-xhCl4AaABAg.8_0qLh3mCgM8_1LyAb9TGZ,Tychoxi,1 month ago,1510997162834,cne08 did I say he was? Bush isn't POTUS either but I still think he should be put on trial like his successors and is partly responsible for the current reality.,0,/Negative/,Negative,0.658
UgwjYhJarwa_kyHHyGh4AaABAg,Miles Weaver,1 month ago,1510997162490,"Portugal is the 43rd richest country on earth, and in the top 25 richest European countries. It is not 'one of the poorest countries in Europe'.",0,false,0,,,,,,,/Positive/,Positive,0.791
UgxEzJn7zPLC9c0JUDx4AaABAg,Amy Nicholls,1 month ago,1510997162494,"Some may not be familiar with the fact that according to the President’s most recent FEC disclosure, the Trumps actual own or have owned stock in Raytheon. That’s right, the 59 missiles, that Trump hurled at Syria — which cost taxpayers somewhere between $47 million and $82 million — could’ve actually turned a profit for the president. And it is said he also has stock in other defence companies ... makes you think doesn't it!!",5,false,0,,,,,,,/Negative/,Negative,0.473
UgxLey3azy3x4fyY-TF4AaABAg,Damien Thorn,1 month ago,1510997162496,"It's always about the corporations.  They run the country and since Trump won election, the voters will only count in 2020.  Trump knows racism, religion, prolife, war mongering, gun rights, etc will win him his base again.  What is the point of this video?  It doesn't matter who is in power, money talks, voters only matter briefly every 4 years.",2,false,0,,,,,,,/Positive/,Positive,0.775
Ugz0CjhMa9j39iuBE0p4AaABAg,Miss Kimberly,1 month ago,1510997162499,This will be a crazy twist of irony when these weapons make their way into the hands of opponents.,6,true,5,,,,,,,/Positive/,Positive,0.945
,,,,,,,,Ugz0CjhMa9j39iuBE0p4AaABAg.8_0mcR2uzwa8_0nEGNvXMk,Ralph Bernhard,1 month ago,1510997162912,"Miss Kimberly   Oh, they will...
As they have in the past, killing Americans.
Causality is a bitch...",3,/Negative/,Negative,0.928
,,,,,,,,Ugz0CjhMa9j39iuBE0p4AaABAg.8_0mcR2uzwa8_0uF_TNM_l,Mob Flork,1 month ago,1510997162915,"Only naive idiots believe that if the US doesn't sell weapons, that they wouldn't exist.   I guess we shouldn't sell anything on the off chance that those goods will be used to fuel our enemy's war machine.   Right? 

No, that's stupid.",0,/Negative/,Negative,0.994
,,,,,,,,Ugz0CjhMa9j39iuBE0p4AaABAg.8_0mcR2uzwa8_0wgX0Xm4f,8bitpothead,1 month ago,1510997162918,time to wake up Mob... Their comments are getting likes. Yours isn't... Must not be a very popular opinion.,1,/Positive/,Positive,0.914
,,,,,,,,Ugz0CjhMa9j39iuBE0p4AaABAg.8_0mcR2uzwa8_1-L9WBH3f,John Williams,1 month ago,1510997162920,"Mob Flork only naive idiots can watch congress raise the military spending budget to 700 billion to build more weapons and then find out that the president is essentially acting like a door to door (country to country) salesman selling off these weapons for money that will go into private hands instead of back into the hands of taxpayers who paid for them and not realize what a criminal racket this is. Steal money from us to fund an excess inventory they can then sell off to line their own pockets, open your goddamn eyes.",0,/Negative/,Negative,0.893
,,,,,,,,Ugz0CjhMa9j39iuBE0p4AaABAg.8_0mcR2uzwa8_121ii7tT0,Rockyblack smith,1 month ago,1510997162923,"+Mob Flork
1. The more weapons there are around, the cheaper they get. So even if the weapons the US sells don't end up in terrorist hands, flooding the market makes it easier for terrorists to get their hands on other weapons. 
2. Weapons of war have a direct impact on a nations capabilities and influence. Any object of trade of similar significance (such as, say, uranium) is treated apropriately. It's not just an object of trade (meaning it's regarded as nothing more than it's material worth), but as a political asset. 
And especially advanced military technology, for which  there are few producers, has an enormous impact, both if sold and if withheld. 
Thus treating arms deals as just a commercial matter is utterly ignorant of their significance.",1,/Negative/,Negative,0.49
Ugz69FC1_SAShm85bHR4AaABAg,Roger Plessen,1 month ago,1510997163826,"Our main exports are weapons and food. What's wrong with being the number one arms seller in the world....the new Rome.We used to sell manufactured goods but now China etc makes the consumer goods. Painfully all we have to sell is guns and food. Oh well. We are a gun toting. armed society. And that is who we are! At least we are unlikely to be taken over by anyone. And we are a rather harsh capitalist society where homeless starve in the streets and gamgs sell drugs and jails are full of thugs and killers. The wild west! We need to get them work and places to live and go back to what our people do best....That is just who we are....make no mistake about it ...we are a rough and ready people,  the refugees and independent freedom loving impatient people from all over the world. And America isn't going to let anyone step on our toes!",0,true,2,,,,,,,/Negative/,Negative,0.68
,,,,,,,,Ugz69FC1_SAShm85bHR4AaABAg.8_0m_1gBs-T8_0nWNzuZJo,Ralph Bernhard,1 month ago,1510997164208,"Roger Plessen   Irony, that America has become what Europe was for more than a thousand years.
Irony, that today Americans have morphed into what their forefathers have tried to escape in the war-ravaged Europe of history.
Oh, how the tables have turned...",3,/Negative/,Negative,0.738
,,,,,,,,Ugz69FC1_SAShm85bHR4AaABAg.8_0m_1gBs-T8_0v0SQSNtY,Mob Flork,1 month ago,1510997164213,Ralph Bernhard Irony that you have no idea what you're talking about.,0,/Negative/,Negative,0.893
Ugw_PuemIZaoikmnobp4AaABAg,OJ Basil,1 month ago,1510997163830,"Bruh this fanbase is as bad as diehard magas, thinking you're better than the other side and assume anyone who disagrees to be agents of whatever enemy like sheesh. I don't know how any of you consider yourself morally superior, you have no principles to be consistent with other than hatred for each other",1,false,0,,,,,,,/Negative/,Negative,0.957
UgyiJsJXlowS8G49mNp4AaABAg,Karl Liebknecht,1 month ago,1510997163833,He's just taking the NATO racketeering practices to the next level.,3,false,0,,,,,,,/Negative/,Negative,0.463
UgzY2BSOVbmY4flTspN4AaABAg,Xenite227,1 month ago,1510997163835,"Sell some weapons to Taiwan, that will work out awesome Donnie.",4,false,0,,,,,,,/Positive/,Positive,0.998
Ugz8AwkMUrTxwE8d8194AaABAg,Fred Munoz,1 month ago,1510997163838,"He owns stock in corporations that make weapons. It the same reason he dropped bombs in the middle of dessert, and he saber rattles.",4,false,0,,,,,,,/Negative/,Negative,0.721
UgxBZxaRemJci8uvxGd4AaABAg,Shayke Speeer,1 month ago,1510997163841,"Trump would sell his own grandchildren if he could make enough profit off them.  The manchild does not give a shit about consequences, just profits.  Money is all Trump cares about.  Nothing else.",10,false,0,,,,,,,/Negative/,Negative,0.998
UgzuTF6Xck3X-XmcTEJ4AaABAg,Wordavee1,1 month ago,1510997163844,"Make the world better, everyone get more weapons of war!!",5,false,0,,,,,,,/Positive/,Positive,0.898
UgzlC1VdX3aIvElRHht4AaABAg,waterandafter,1 month ago,1510997163847,He's making deals...,0,true,2,,,,,,,/Negative/,Negative,0.998
,,,,,,,,UgzlC1VdX3aIvElRHht4AaABAg.8_0ifSjFX_r8_0jR2kituN,Ralph Bernhard,1 month ago,1510997164224,"waterandafter ....which benefit him and his ilk, but will in future result in American ""Joe the Plumber"" folks dying in some shithole halfway across the planet....
Who gets the star-spangled coffin or a few cheap Purple Hearts?
Who gets the vila by the sea?",3,/Negative/,Negative,0.744
,,,,,,,,UgzlC1VdX3aIvElRHht4AaABAg.8_0ifSjFX_r8_0ntD11zJg,waterandafter,1 month ago,1510997164227,"Ralph Bernhard 
Yup.",3,/Neutral/,Neutral,0.543
UgyuoYqSABYs1Qy1zix4AaABAg,Daddy Government,1 month ago,1510997163851,why does tyt think it's OK to have an all female cast?,1,true,3,,,,,,,/Negative/,Negative,0.998
,,,,,,,,UgyuoYqSABYs1Qy1zix4AaABAg.8_0ifKNs6_R8_0jnsf2-ig,M. Öckthem,1 month ago,1510997164477,Daddy Government because they're not a sexist like you?,7,/Negative/,Negative,0.988
,,,,,,,,UgyuoYqSABYs1Qy1zix4AaABAg.8_0ifKNs6_R8_0nqyRrFUm,DeadliestWarriorZZ,1 month ago,1510997164480,"Because they're the best experts TYT has on international policy, international law, weapon sales and the inner workings of Trump's mind...",1,/Positive/,Positive,0.951
,,,,,,,,UgyuoYqSABYs1Qy1zix4AaABAg.8_0ifKNs6_R8_1DWpgeNEd,cne08,1 month ago,1510997164482,Why do you think it ISN'T ok to have an all female cast Daddy Government?,0,/Negative/,Negative,0.945
UgxioB4WLD_gUyGVn2Z4AaABAg,CountJimbo,1 month ago,1510997163856,"Dear Americans - please stop selling weapons to other countries and continuing to bring destruction, torture and massacre across the world, sincerely - the civilised world",19,true,4,,,,,,,/Neutral/,Neutral,0.602
,,,,,,,,UgxioB4WLD_gUyGVn2Z4AaABAg.8_0iT3urUcr8_0mPTJby_g,A Voter,1 month ago,1510997164456,CountJimbo...Don't expect non profit from republicans.,0,/Negative/,Negative,0.99
,,,,,,,,UgxioB4WLD_gUyGVn2Z4AaABAg.8_0iT3urUcr8_0mzSG3Kjx,Miss Kimberly,1 month ago,1510997164459,"""Americans"" aren't selling weapons. Donald Trump, the guy who lost the election by almost 4,000,000 voted, is selling weapons....",3,/Negative/,Negative,0.986
,,,,,,,,UgxioB4WLD_gUyGVn2Z4AaABAg.8_0iT3urUcr8_0oUg0dEvx,DeadliestWarriorZZ,1 month ago,1510997164462,He won in a fair manner...by the system your people put in place...,1,/Positive/,Positive,0.934
,,,,,,,,UgxioB4WLD_gUyGVn2Z4AaABAg.8_0iT3urUcr8_1V4-WBV_3,Long_Duck Dong,1 month ago,1510997164465,Miss Kimberly you do realize that we live in a republic and that’s the reason he won is because we live in a country that give every state a voice so the bigger states don’t control the election.,0,/Positive/,Positive,0.855
UgwWGgJ8m9fctuIRZGV4AaABAg,Ben Warhurst,1 month ago,1510997163860,Did Obama and Hillary do anything different ? Weapons sales under Obama/Clinton=roughly 300 billion,3,true,7,,,,,,,/Neutral/,Neutral,0.783
,,,,,,,,UgwWGgJ8m9fctuIRZGV4AaABAg.8_0iLYqjN988_0ipxTFG1A,Frank De Mascio,1 month ago,1510997164418,"Ben Warhurst 
Bot",0,/Neutral/,Neutral,0.998
,,,,,,,,UgwWGgJ8m9fctuIRZGV4AaABAg.8_0iLYqjN988_0jc9flEzN,Ralph Bernhard,1 month ago,1510997164421,"Ben Warhurst    It is still America selling the arms.
The rest of the world doesn't care about your internal political leadership.",4,/Negative/,Negative,0.984
,,,,,,,,UgwWGgJ8m9fctuIRZGV4AaABAg.8_0iLYqjN988_0kJDmiCAF,El León Heart,1 month ago,1510997164424,"The thing is Obama’s and Clinton let the Military sell itself , they were smart enough to actually craft Legislation and International union to supply our weapons , Trumps Admin is too stupid to understand diplomacy and how you make deals So he’s just out here Hustling Stinger missiles like Rappers hustle Mix Tapes 😂😂😂",2,/Negative/,Negative,0.811
,,,,,,,,UgwWGgJ8m9fctuIRZGV4AaABAg.8_0iLYqjN988_0ltlCHvVz,Fred Munoz,1 month ago,1510997164428,"Ben Warhurst: Great argument ""Obama and Hillary murdered therefore it's okay if the Creature murders"".  You win the debate.",2,/Positive/,Positive,0.998
,,,,,,,,UgwWGgJ8m9fctuIRZGV4AaABAg.8_0iLYqjN988_0n5yQb4ZD,Miss Kimberly,1 month ago,1510997164431,You're right. Didn't Trump voters want change?,4,/Positive/,Positive,0.814
,,,,,,,,UgwWGgJ8m9fctuIRZGV4AaABAg.8_0iLYqjN988_12QJyr-h9,Rockyblack smith,1 month ago,1510997164433,"Oh, it's a whataboutist trying to divert the discussion.
And he FAILED!",1,/Negative/,Negative,0.928
,,,,,,,,UgwWGgJ8m9fctuIRZGV4AaABAg.8_0iLYqjN988_1De_XUL4J,cne08,1 month ago,1510997164436,Hillary NEVER was POTUS and Obama ISN'T POTUS anymore Ben Warhurst.,1,/Negative/,Negative,0.998
UgznPt0d_F54avuSrkZ4AaABAg,Nathan Millington,1 month ago,1510997163864,The deep seeded level of government corruption through money in politics has never made so much sense until after this election. Bernie was right.....and the poor guy fell victim to exactly that.,7,false,0,,,,,,,/Negative/,Negative,0.998
UgwasxjVZrDcHDUv8UZ4AaABAg,Alan Heath,1 month ago,1510997163867,I don't like Trump but it is his duty to support US industry.,2,true,6,,,,,,,/Positive/,Positive,0.506
,,,,,,,,UgwasxjVZrDcHDUv8UZ4AaABAg.8_0i7p-655b8_0lov6bWKE,Peace Dog,1 month ago,1510997164292,"Alan Heath 
Even the industry that allows dictators to kill civilians in their own countries and foreign ones?",3,/Positive/,Positive,0.965
,,,,,,,,UgwasxjVZrDcHDUv8UZ4AaABAg.8_0i7p-655b8_0m13otbK3,Fred Munoz,1 month ago,1510997164296,At the expense of our security?,2,/Neutral/,Neutral,0.684
,,,,,,,,UgwasxjVZrDcHDUv8UZ4AaABAg.8_0i7p-655b8_0nmZuszUk,Freely Liberal,1 month ago,1510997164299,"Gotta love how righties try to fob off murder as ""industry"".  Pure rednecks.",2,/Positive/,Positive,0.973
,,,,,,,,UgwasxjVZrDcHDUv8UZ4AaABAg.8_0i7p-655b8_0xS819diH,Konstantin Krastev,1 month ago,1510997164302,"So instead of being pioneers in renewable energy, new technology, drug manifacturing and research let's go with weapons. Sad, bigly",0,/Negative/,Negative,0.682
,,,,,,,,UgwasxjVZrDcHDUv8UZ4AaABAg.8_0i7p-655b8_1A47xP38C,Alan Heath,1 month ago,1510997164304,I agree that that would be preferable.,0,/Negative/,Negative,0.67
,,,,,,,,UgwasxjVZrDcHDUv8UZ4AaABAg.8_0i7p-655b8_1ADJF6LVe,Alan Heath,1 month ago,1510997164308,In the first place I am not a right and in the second where is murder written?  Why do you need to make things up?,0,/Negative/,Negative,0.77
UgzpPxJzb0ps324SQ314AaABAg,Zaphod Beeblebrox,1 month ago,1510997163871,"So Trump can’t deal with anything politically, but he’s a wiz at arms dealing.
Is his agenda to take the whole planet to the brink of WW3 so he can start selling weapons?
I bet he’s got lots of shares in these Arms manufacturers. Just another thing to investigate about Trump( the self serving prick).",6,true,1,,,,,,,/Negative/,Negative,0.533
,,,,,,,,UgzpPxJzb0ps324SQ314AaABAg.8_0hmJYBYnd8_0iQj--4t8,Ralph Bernhard,1 month ago,1510997164330,"Zaphod Beeblebrox   Even if he doesn't personally own stocks or shares, his ilk certainly does.
He will therefore benefit indirectly, in the form of some kind of  covered-up ""donation"", hotel booking, an ""event"" on one of his golf courses. You name it...
That's how it works.",1,/Positive/,Positive,0.834
Ugw8X7JVc4PARWcvGsh4AaABAg,bradley murray,1 month ago,1510997163875,I think ICE needs to raid the TYT set because the one in the middle looks like a illegal immigrant,3,true,5,,,,,,,/Negative/,Negative,0.943
,,,,,,,,Ugw8X7JVc4PARWcvGsh4AaABAg.8_0hX2KP8ZX8_0iqoOhI8Z,waterandafter,1 month ago,1510997164346,"bradley murray 
That's the problem, people assuming citizenship based on looks.",4,/Negative/,Negative,0.904
,,,,,,,,Ugw8X7JVc4PARWcvGsh4AaABAg.8_0hX2KP8ZX8_0itomQWiy,Frank De Mascio,1 month ago,1510997164349,"bradley murray 
Bot",2,/Neutral/,Neutral,0.885
,,,,,,,,Ugw8X7JVc4PARWcvGsh4AaABAg.8_0hX2KP8ZX8_0nb60yR2o,Miss Kimberly,1 month ago,1510997164352,"Huh. There are multiple scientific studies that show there is a huge correlation between people who make uneducated assumptions, and low intelligence levels. 

It's okay buddy. Not all Americans can have brains.",2,/Negative/,Negative,0.627
,,,,,,,,Ugw8X7JVc4PARWcvGsh4AaABAg.8_0hX2KP8ZX8_0tH4N0G2O,Ralph Bernhard,1 month ago,1510997164356,"bradley murray   I think the FBI needs to raid your house, because your daddy...ahem...""looks like"" the Texas shooter....",2,/Negative/,Negative,0.594
,,,,,,,,Ugw8X7JVc4PARWcvGsh4AaABAg.8_0hX2KP8ZX8_0w0ASoQHp,Malcolm Sprott,1 month ago,1510997164359,bradley murray your name doesn't sound like a Native American name beware of ice knocking on your door,1,/Negative/,Negative,0.912
Ugw4M_VGyo2MuT7x2hN4AaABAg,Bo Rosenkilde,1 month ago,1510997163879,"All you guyes have to offer the world, weapons and war......",8,true,1,,,,,,,/Neutral/,Neutral,0.682
,,,,,,,,Ugw4M_VGyo2MuT7x2hN4AaABAg.8_0h0hH0XqX8_0haWcYQbW,Nancy Mesek,1 month ago,1510997164316,Bo Rosenkilde   Peace doesn’t line their pockets.,1,/Negative/,Negative,0.998
Ugw8DcXh0t-HKUpmcBJ4AaABAg,wooden.minds,1 month ago,1510997163883,"Wrong application of the word ""securitization"".",1,true,1,,,,,,,/Negative/,Negative,0.99
,,,,,,,,Ugw8DcXh0t-HKUpmcBJ4AaABAg.8_0gx1HH0v98_0jvHb1o1K,Vlad Snape,1 month ago,1510997164258,"Yes, totally incorrect usage of the word. I guess she used it because she thought it made her sound smart. She failed bigly in sounding smart.",0,/Negative/,Negative,0.857
Ugxd4JZQA4Iy5GJflnR4AaABAg,brad kessler,1 month ago,1510997163887,trump is a real president.,2,true,2,,,,,,,/Positive/,Positive,0.998
,,,,,,,,Ugxd4JZQA4Iy5GJflnR4AaABAg.8_0gt8ohM9Z8_0iwuLoToI,Frank De Mascio,1 month ago,1510997164271,"brad kessler 
Bot",1,/Positive/,Positive,0.457
,,,,,,,,Ugxd4JZQA4Iy5GJflnR4AaABAg.8_0gt8ohM9Z8_0iyPhBTRb,waterandafter,1 month ago,1510997164275,"brad kessler 
Of course he is, he was elected. 
But he is also a really shitty president.",4,/Positive/,Positive,0.965
UgwH5fj8BMMoGRyUnll4AaABAg,Kars Kars,1 month ago,1510997163891,IT'S OKAY TO BE WHITE 👌,4,true,7,,,,,,,/Positive/,Positive,0.994
,,,,,,,,UgwH5fj8BMMoGRyUnll4AaABAg.8_0gg6uy7kw8_0iyEaXrRz,Frank De Mascio,1 month ago,1510997164379,"Lars Kars 
Bot",0,/Positive/,Positive,0.994
,,,,,,,,UgwH5fj8BMMoGRyUnll4AaABAg.8_0gg6uy7kw8_0jonoBnUy,Kars Kars,1 month ago,1510997164381,"Frank De Mascio, 👌",1,/Positive/,Positive,0.998
