,,,,,,,,,,,,,,Classification path,Level 1 label,Level 1 probability,Level 2 label,Level 2 probability
UgyWOZpciRdWFQSZJPh4AaABAg,IdarkphoenixI,1 month ago,1510994171080,"Ana - ""Don't feed the trolls, just let them get excited over this app, who cares""

meanwhile on Ana's Twitter - ""TO ALL YOU F***ING LOSERS SENDING ME PICS OF MYSELF FROM THIS SEXIST APP - F**K YOU!!!!!""",8,true,8,,,,,,,/Positive/Love/,Positive,0.345,Love,0.242
,,,,,,,,UgyWOZpciRdWFQSZJPh4AaABAg.8_3HeSvfHtg8_3Hqo23g5n,Star Citizen,1 month ago,1510994171735,"You know the apps developer thinks this app will help find missing children, but Anna looking like a hob goblin without 5 pounds of clown make up is more important than that....",0,/Negative/Worry/,Negative,0.562,Worry,0.268
,,,,,,,,UgyWOZpciRdWFQSZJPh4AaABAg.8_3HeSvfHtg8_3J00-4_Re,Dr Orgasm donor,1 month ago,1510994171739,IdarkphoenixI she’s a hypocrite,0,/Neutral/Surprise/,Neutral,0.422,Surprise,0.83
,,,,,,,,UgyWOZpciRdWFQSZJPh4AaABAg.8_3HeSvfHtg8_3NbX3JDA3,Darren Ong,1 month ago,1510994171742,Exactly,0,/Neutral/Empty tweets / Garbage / No sentiments/,Neutral,0.599,Empty tweets / Garbage / No sentiments,0.726
,,,,,,,,UgyWOZpciRdWFQSZJPh4AaABAg.8_3HeSvfHtg8_3Q2QB053O,Oscar Evans,1 month ago,1510994171746,"LOL she addresses this in the video. That that's not her twitter post and she never said that, it's a fake tweet. Did you miss that?",8,/Negative/Worry/,Negative,0.493,Worry,0.263
,,,,,,,,UgyWOZpciRdWFQSZJPh4AaABAg.8_3HeSvfHtg8_3Sp-MWXU7,IdarkphoenixI,1 month ago,1510994171749,"LOL, I saw her say it on her account. It's real",0,/Positive/Happiness/,Positive,0.534,Happiness,0.261
,,,,,,,,UgyWOZpciRdWFQSZJPh4AaABAg.8_3HeSvfHtg8_3T-UQCHQ8,FireFlame Burns,1 month ago,1510994171752,"Oscar Evans Lol! I don't think they care it was fake. Seems they REALLY want her to be a hypocrite, so they deny reality.",2,/Positive/Love/,Positive,0.424,Love,0.234
,,,,,,,,UgyWOZpciRdWFQSZJPh4AaABAg.8_3HeSvfHtg8_3VpaRPMy-,Chance Anderson,1 month ago,1510994171755,"watch the video noob.  it's photoshopped.  if it's real, provide some proof.  fake news bitch",2,/Neutral/Surprise/,Neutral,0.398,Surprise,0.548
,,,,,,,,UgyWOZpciRdWFQSZJPh4AaABAg.8_3HeSvfHtg8_3VtTM7OM7,IdarkphoenixI,1 month ago,1510994171759,"The picture is shopped, her tweet was real",1,/Positive/Happiness/,Positive,0.479,Happiness,0.284
UgxqUqlLPjVkJZzZ1g94AaABAg,Divya Agarwal,1 month ago,1510994171086,A general observation: A self-esteem built on pseudopretenses is better broken than held together.,1,false,0,,,,,,,/Neutral/Surprise/,Neutral,0.415,Surprise,0.609
UgzwNdyX3qnPYhOCEYZ4AaABAg,DovahFem,1 month ago,1510994171089,"""Ladies, don't react to this,"" said Ana Kasparian, in the six-minute segment of her reacting to it. Like, you literally posted a picture of yourself without makeup just to engage the trolls who photoshopped you reacting to it. Plus, you dedicating an entire segment to this is only advertising the app further, something you said people SHOULDN'T do. This is a boring and unneccessary story, it feels a little self serving on Ana's part.",16,true,3,,,,,,,/Negative/Hate/,Negative,0.453,Hate,0.245
,,,,,,,,UgzwNdyX3qnPYhOCEYZ4AaABAg.8_3GV0Q_fh68_3Gl1R-i4J,Star Citizen,1 month ago,1510994171667,Not to mention if you look close at the pic she is wearing makeup around her eyes. According to the app she looks like a goblin who is almost 40.,2,/Neutral/Surprise/,Neutral,0.535,Surprise,0.786
,,,,,,,,UgzwNdyX3qnPYhOCEYZ4AaABAg.8_3GV0Q_fh68_3GuP5sub2,Internet Tuff Guy,1 month ago,1510994171670,Ana Kasparian is the absolute definition of what a Man who's serious about himself should avoid.,3,/Negative/Anger/,Negative,0.374,Anger,0.25
,,,,,,,,UgzwNdyX3qnPYhOCEYZ4AaABAg.8_3GV0Q_fh68_3HQCzoA6X,Star Citizen,1 month ago,1510994171673,You know the apps developer actually believe it will benefit missing children....But ya know Anna looking like a troll without 5 pounds of clown make up on is more important.,2,/Negative/Worry/,Negative,0.436,Worry,0.275
UgxRosunluFEke2hqY94AaABAg,Patrick Pepin,1 month ago,1510994171095,Let's be honest women use makeup to fool men to believe they are more attractive than they really are... most women know they are not as hot as they want you to think they are.,12,true,1,,,,,,,/Neutral/Surprise/,Neutral,0.375,Surprise,0.86
,,,,,,,,UgxRosunluFEke2hqY94AaABAg.8_3G031koOP8_3GnKVhQun,DovahFem,1 month ago,1510994171692,"Yeah you're right, I spent 50$ on a palette that smells like peaches for the sole purpose of fooling men. ""Wow, these glittery shades will surely trick men into thinking my eyelids are naturally green! Muahahaa""",5,/Negative/Anger/,Negative,0.366,Anger,0.235
Ugxs6zL1MEqhzOL3Se14AaABAg,Listenbuddy1,1 month ago,1510994171100,Here’s an idea. Look in the mirror after a shower. (rolls eyes),1,false,0,,,,,,,/Neutral/Surprise/,Neutral,0.511,Surprise,0.692
Ugw__17D4mfjk5NI6tx4AaABAg,HomySwagYolo,1 month ago,1510994171104,nose job hair dye ana kasparian says she doesnt care what people think she looks like,10,true,3,,,,,,,/Neutral/Surprise/,Neutral,0.407,Surprise,0.845
,,,,,,,,Ugw__17D4mfjk5NI6tx4AaABAg.8_3F-w16tft8_3F7I997GA,MrLeermeister,1 month ago,1510994171816,"Yeah, does not help she looks like ODO from DS9 on the app",0,/Negative/Worry/,Negative,0.514,Worry,0.255
,,,,,,,,Ugw__17D4mfjk5NI6tx4AaABAg.8_3F-w16tft8_3HTDQC7PM,ElectroMechaCat,1 month ago,1510994171822,"Well, maybe SHE herself didn,t like what she looked like before. You need to feel comfortable with yourself. You shouldn,t change yourself because of others. But if you feel uncomfortable, you should be free to change yourself without judgement.",0,/Negative/Worry/,Negative,0.438,Worry,0.248
,,,,,,,,Ugw__17D4mfjk5NI6tx4AaABAg.8_3F-w16tft8_3IGghzlG8,Star Citizen,1 month ago,1510994171826,Also you need to smack  on a few pounds of clown make up in order to feel better about yourself......,0,/Negative/Worry/,Negative,0.441,Worry,0.285
UgzTc6KFzT562wwZVIV4AaABAg,coolbanana165,1 month ago,1510994171110,I don't really get how this is sexist,3,false,0,,,,,,,/Negative/Worry/,Negative,0.549,Worry,0.235
UgxkHrIQAh1JHJvs2cx4AaABAg,Bon Qui Qui,1 month ago,1510994171115,Makeup to women are beards to men.,6,true,3,,,,,,,/Positive/Happiness/,Positive,0.363,Happiness,0.24
,,,,,,,,UgxkHrIQAh1JHJvs2cx4AaABAg.8_3EeAHjMo38_3HIC2CTcf,KeviBx,1 month ago,1510994171538,N A yo facts,0,/Neutral/Empty tweets / Garbage / No sentiments/,Neutral,0.471,Empty tweets / Garbage / No sentiments,0.684
,,,,,,,,UgxkHrIQAh1JHJvs2cx4AaABAg.8_3EeAHjMo38_3K4HIqmJH,imnotmike,1 month ago,1510994171543,"Yeah, it sucks, because all women can get proper makeup, but some of us unlucky men are born beard challenged and have to live our lives with an awful makeup job or none at all :P",0,/Negative/Hate/,Negative,0.57,Hate,0.22
,,,,,,,,UgxkHrIQAh1JHJvs2cx4AaABAg.8_3EeAHjMo38_3TAb3PWeV,Archivian,1 month ago,1510994171548,N A lol that just made me laugh so hard LOL,0,/Positive/Happiness/,Positive,0.676,Happiness,0.326
Ugwvb9AXwRaqVwrvzUF4AaABAg,Coos Oorlog,1 month ago,1510994171120,Must be a miserable life to be obsessed over a news show host.,9,true,2,,,,,,,/Neutral/Surprise/,Neutral,0.482,Surprise,0.642
,,,,,,,,Ugwvb9AXwRaqVwrvzUF4AaABAg.8_3EF0Kgngd8_3EYNWDKIk,MrLeermeister,1 month ago,1510994171650,Especially one that looks like ODO from DS9 on the app when she is not wearing makeup.,3,/Neutral/Surprise/,Neutral,0.453,Surprise,0.83
,,,,,,,,Ugwvb9AXwRaqVwrvzUF4AaABAg.8_3EF0Kgngd8_3GakA6vb7,Coos Oorlog,1 month ago,1510994171654,^found one!,5,/Neutral/Surprise/,Neutral,0.474,Surprise,0.508
UgyZmtPaZu3GWezEKh54AaABAg,SteveMHN,1 month ago,1510994171126,"Ana keeps saying she doesn't care, but clearly she does.",7,true,1,,,,,,,/Negative/Worry/,Negative,0.483,Worry,0.231
,,,,,,,,UgyZmtPaZu3GWezEKh54AaABAg.8_3DqMx5UQZ8_3EKDLUl5s,MrLeermeister,1 month ago,1510994171684,"Yep, why else would she put a ton of make up on everyday and also get a nose job if she really did not care...",1,/Negative/Worry/,Negative,0.663,Worry,0.253
Ugzae530j8RtUvEOSo94AaABAg,Islam is cancer,1 month ago,1510994171131,"Wow, Ana looks like shit.",8,true,1,,,,,,,/Negative/Worry/,Negative,0.484,Worry,0.235
,,,,,,,,Ugzae530j8RtUvEOSo94AaABAg.8_3CdAec8hW8_3Ctgn9YFA,MrLeermeister,1 month ago,1510994171564,She looks like ODO from DS9 according to the app,0,/Neutral/Surprise/,Neutral,0.371,Surprise,0.791
Ugw_RCOoEMWojffYB6B4AaABAg,Gail Bull,1 month ago,1510994171138,I'd love to see what their filtered version of me would look like. The only make-up I wear is mascara and eyebrow pencil. They'd probably end up with something that looks like Anaksunamun from the 1990's  The Mummy movie after she's been dead for a couple of thousand years.,2,true,1,,,,,,,/Negative/Worry/,Negative,0.414,Worry,0.277
,,,,,,,,Ugw_RCOoEMWojffYB6B4AaABAg.8_3Bcyhg3mZ8_3E6MYwhMD,MrLeermeister,1 month ago,1510994171494,It would probably show what you look like without your eyebrow scribbles and your mascara.....Or show that you use more make up than you claim.,0,/Positive/Enthusiasm/,Positive,0.405,Enthusiasm,0.275
UgyHBHDEJuxUZROqRA94AaABAg,Internet Tuff Guy,1 month ago,1510994171143,"All you TYT losers think Ana Kasparian is sooo sexy, but she looks like shit without makeup and her personality is completely repulsive and immature.",11,true,1,,,,,,,/Negative/Worry/,Negative,0.557,Worry,0.24
,,,,,,,,UgyHBHDEJuxUZROqRA94AaABAg.8_3AoqEaYq08_3BL1AkaPy,MrLeermeister,1 month ago,1510994171573,"She looks like that thing on Deep space 9 called ""the founder"" which is a member of Odos race.......Without makeup on the app. I think it is a shape shifter on Deep space 9",3,/Neutral/Surprise/,Neutral,0.394,Surprise,0.679
UgwuQmndU6T2umJvlqN4AaABAg,Urius Tosh,1 month ago,1510994171148,"Second or third date, take her swimming. Time tested and proven.",4,true,3,,,,,,,/Positive/Relief/,Positive,0.454,Relief,0.332
,,,,,,,,UgwuQmndU6T2umJvlqN4AaABAg.8_3A_LTJwOm8_3Bai5rsxB,MrLeermeister,1 month ago,1510994171772,pffft I always wake up the next day with them so i gits to see em get out of the shower long before the 3rd date.. Cuzzz I cool,0,/Positive/Happiness/,Positive,0.442,Happiness,0.241
,,,,,,,,UgwuQmndU6T2umJvlqN4AaABAg.8_3A_LTJwOm8_3KfusDWKk,imnotmike,1 month ago,1510994171775,"@MrLeermeister - yeah, but by then it's too late.  You can try to strut and play it cool, but we'll all recognize your walk of shame after you find out you just hooked up with The Creature from the Black Lagoon.",1,/Positive/Relief/,Positive,0.524,Relief,0.255
,,,,,,,,UgwuQmndU6T2umJvlqN4AaABAg.8_3A_LTJwOm8_3WiF1HiVu,Bam Westy,1 month ago,1510994171778,imnotmike lmao,0,/Positive/Fun/,Positive,0.712,Fun,0.407
Ugwz2BrF4V52kaSiVed4AaABAg,Richard Peck,1 month ago,1510994171154,"makeup is designed to trigger a sexual response in men. It is literally asking for it. Have you ever heard the phrase ""Be yourself""? Sound advice. I think it's a standard countermeasure to low self esteem",2,true,2,,,,,,,/Neutral/Surprise/,Neutral,0.407,Surprise,0.621
,,,,,,,,Ugwz2BrF4V52kaSiVed4AaABAg.8_39icZ3hUi8_3BPl0myja,Victoria Masey,1 month ago,1510994171634,Richard Peck So why do lesbians wear make up? And married and elderly women? And women who are perfectly confident and have healthy self-esteem?,3,/Neutral/Surprise/,Neutral,0.401,Surprise,0.546
,,,,,,,,Ugwz2BrF4V52kaSiVed4AaABAg.8_39icZ3hUi8_3FyBYB4qX,Anna young,1 month ago,1510994171638,Richard Peck make up is not designed to create a sexual response in men. Makeup is a form of self expression . In history when women did not have makeup they also did not have freedom of speech .. during some of those periods men wore makeup only . I have studied briefly makeup history . I am not done with my studies. There is no end to what we can learn.,0,/Negative/Worry/,Negative,0.635,Worry,0.246
Ugwv_gYyWCs7-PK1P0J4AaABAg,cloudbuster77,1 month ago,1510994171159,"I call BS! Ana has always been obsessed with how the public judges her, especially when it comes to her looks. She got a nose job for instance.",7,true,3,,,,,,,/Negative/Worry/,Negative,0.387,Worry,0.223
,,,,,,,,Ugwv_gYyWCs7-PK1P0J4AaABAg.8_394RaW4jW8_39t6AcM0c,Natasha Nazer,1 month ago,1510994171704,cloudbuster77 It's because SHE didn't like her nose. Not because she was concerned about other people not liking her nose.,3,/Negative/Hate/,Negative,0.549,Hate,0.253
,,,,,,,,Ugwv_gYyWCs7-PK1P0J4AaABAg.8_394RaW4jW8_3AhySA5T_,MrLeermeister,1 month ago,1510994171707,"+Natasha Nazer was the nose not smelling correctly for her? It is far more likely she did it because she believed she would become more attractive to others, as opposed to making herself attracted herself more looking in a mirror........Also she wears a ton of makeup, please run it through your crystal ball as to why she does these pointless things.",1,/Negative/Worry/,Negative,0.424,Worry,0.281
,,,,,,,,Ugwv_gYyWCs7-PK1P0J4AaABAg.8_394RaW4jW8_3C_0gqR3a,cloudbuster77,1 month ago,1510994171712,BS,1,/Neutral/Empty tweets / Garbage / No sentiments/,Neutral,0.427,Empty tweets / Garbage / No sentiments,0.527
UgxyTpM1-e8o8voNjwR4AaABAg,Sl Mailouts,1 month ago,1510994171164,She doesn't care about it so much that she does a whole segment about it and puts up a picture 'without makeup',10,true,3,,,,,,,/Negative/Worry/,Negative,0.527,Worry,0.216
,,,,,,,,UgxyTpM1-e8o8voNjwR4AaABAg.8_38jeg7nsy8_3AP8wmcOY,gunnyblender,1 month ago,1510994171614,Don't know if trolling or too stupid to notice she was devoted to dissing trolls.. But I do know you're a stupid troll. ;),1,/Negative/Anger/,Negative,0.647,Anger,0.231
,,,,,,,,UgxyTpM1-e8o8voNjwR4AaABAg.8_38jeg7nsy8_3AUcqPoJc,Natasha Nazer,1 month ago,1510994171618,Sl Mailouts You clearly missed the whole point of the segment.,1,/Negative/Sadness/,Negative,0.698,Sadness,0.254
,,,,,,,,UgxyTpM1-e8o8voNjwR4AaABAg.8_38jeg7nsy8_3C2eLSJfA,MrLeermeister,1 month ago,1510994171622,She does not care that the app makes her look like ODO from deep space nine when she is not wearing makeup.,1,/Negative/Worry/,Negative,0.422,Worry,0.269
Ugy92P57-2FyvylTBjV4AaABAg,PurpleYellowFan,1 month ago,1510994171170,"how are they trolling?      

this outrage shit is getting ridiculous",5,false,0,,,,,,,/Negative/Hate/,Negative,0.706,Hate,0.239
Ugy3AkJVS6XFHJxpCXt4AaABAg,KiNgDoMx,1 month ago,1510994172539,Ana's kinda salty about it comon :P,10,true,2,,,,,,,/Neutral/Empty tweets / Garbage / No sentiments/,Neutral,0.423,Empty tweets / Garbage / No sentiments,0.542
,,,,,,,,Ugy3AkJVS6XFHJxpCXt4AaABAg.8_382Et_TCY8_3AYzbsOWZ,Natasha Nazer,1 month ago,1510994173068,"KiNgDoMx It's spelled ""come on"".",2,/Negative/Worry/,Negative,0.369,Worry,0.243
,,,,,,,,Ugy3AkJVS6XFHJxpCXt4AaABAg.8_382Et_TCY8_3F-Z0_f4r,MrLeermeister,1 month ago,1510994173071,pfffft actually  comon is in the urban dictionary...Crawl out from under your rock instead of correcting peoples slang. Fo realz.,0,/Positive/Fun/,Positive,0.399,Fun,0.232
Ugx7JurU_J_3tUmIt2h4AaABAg,mavishill,1 month ago,1510994172564,If anyone screams sexist against they need a dick in their mouth.,4,false,0,,,,,,,/Neutral/Empty tweets / Garbage / No sentiments/,Neutral,0.439,Empty tweets / Garbage / No sentiments,0.508
UgwbR5wsxvHHEkCU1dt4AaABAg,blinkin,1 month ago,1510994172568,some guys are too pathetic to get attention from women any other way.,1,true,1,,,,,,,/Neutral/Surprise/,Neutral,0.473,Surprise,0.514
,,,,,,,,UgwbR5wsxvHHEkCU1dt4AaABAg.8_37mUnXfyy8_3Edw8MkzP,Nick Knight,1 month ago,1510994173009,Exactly. The Pick Up community teaches them to neg: the last resort of pathetically immature guys with a personality deficit.,0,/Negative/Hate/,Negative,0.359,Hate,0.237
UgzFh_ARlfuNrjLTzc94AaABAg,Syko,1 month ago,1510994172573,I never would have heard of this if you didn’t talk about it.  Time to troll...😏,2,false,0,,,,,,,/Neutral/Surprise/,Neutral,0.404,Surprise,0.624
UgwASY8nDqe7otWChJB4AaABAg,Mr.s Mr.s,1 month ago,1510994172578,You can tell this story gets under Ana's skin even though she is trying so hard to tell us it dose not. Ugly bitch.,6,true,3,,,,,,,/Negative/Hate/,Negative,0.5,Hate,0.269
,,,,,,,,UgwASY8nDqe7otWChJB4AaABAg.8_36Tqqf1Ev8_3AeTeyLki,Natasha Nazer,1 month ago,1510994172983,Mr.s Mr.s Does*,0,/Negative/Worry/,Negative,0.43,Worry,0.274
,,,,,,,,UgwASY8nDqe7otWChJB4AaABAg.8_36Tqqf1Ev8_3BjLVWS05,MrLeermeister,1 month ago,1510994172985,It is because she looks like ODO from deep space 9 without makeup...According to the app,1,/Neutral/Surprise/,Neutral,0.395,Surprise,0.645
,,,,,,,,UgwASY8nDqe7otWChJB4AaABAg.8_36Tqqf1Ev8_4Lf4I3J3s,MrLeermeister,1 month ago,1510994172988,+Davis Beale I see you are still  spamming angry comments virtue signalling while wearing a butt plug,1,/Neutral/Surprise/,Neutral,0.573,Surprise,0.582
UgzkMo3f1_IZlN2aNvd4AaABAg,Mr.s Mr.s,1 month ago,1510994172582,Like this new girl.... so-far.,1,false,0,,,,,,,/Neutral/Surprise/,Neutral,0.373,Surprise,0.715
UgzDumftKZLQEv5w8Fp4AaABAg,Daniel,1 month ago,1510994172586,Its so pathetic how many women are scrambling to label this sexist and abusive. This is what happens when you make a career of your covered-up face being your only attribute.,7,true,3,,,,,,,/Negative/Hate/,Negative,0.566,Hate,0.228
,,,,,,,,UgzDumftKZLQEv5w8Fp4AaABAg.8_35_bFt4oF8_3Ar-MPMkB,gunnyblender,1 month ago,1510994173052,It's so pathetic you're rather blame women than the trolls using an app that is really just a fugly filter to harrass women. ;),0,/Positive/Happiness/,Positive,0.482,Happiness,0.272
,,,,,,,,UgzDumftKZLQEv5w8Fp4AaABAg.8_35_bFt4oF8_3CWyaUhiO,MrLeermeister,1 month ago,1510994173055,"uhhhhhh no, the  makeup is to hide the fugly, that is the whole point wearing it.",3,/Negative/Worry/,Negative,0.421,Worry,0.237
,,,,,,,,UgzDumftKZLQEv5w8Fp4AaABAg.8_35_bFt4oF8_4LTw58LZa,MrLeermeister,1 month ago,1510994173058,Awwww look at David Beale virtue signalling....Usually the man virtue signalling the loudest about women's issues is the rapist.,1,/Neutral/Empty tweets / Garbage / No sentiments/,Neutral,0.446,Empty tweets / Garbage / No sentiments,0.563
UgxoX8vqOwEuy_D4t-N4AaABAg,Bete Noire,1 month ago,1510994172591,Let skanks be skanks.,3,false,0,,,,,,,/Negative/Worry/,Negative,0.417,Worry,0.3
UgwZgavABLHzJfeb_rl4AaABAg,Xenite227,1 month ago,1510994172595,Makeup is worse than beer goggles.,4,false,0,,,,,,,/Neutral/Surprise/,Neutral,0.386,Surprise,0.57
Ugwf1CVBG7pz6JT9OH94AaABAg,qer qrqd,1 month ago,1510994172599,Ana is a 7.2/9,3,true,2,,,,,,,/Neutral/Surprise/,Neutral,0.426,Surprise,0.715
,,,,,,,,Ugwf1CVBG7pz6JT9OH94AaABAg.8_34D6fjtbW8_3H7xYI07P,Star Citizen,1 month ago,1510994173038,4.8 without the 5 pounds of Clown makeup... Even the pic she showed if you look close she is wearing makeup at least around the eyes.,0,/Neutral/Surprise/,Neutral,0.536,Surprise,0.84
,,,,,,,,Ugwf1CVBG7pz6JT9OH94AaABAg.8_34D6fjtbW8_4JZsuIdIg,Star Citizen,1 month ago,1510994173041,"pfft get a life, fruit. My profiles private so retards like you see nothing when they look.",0,/Neutral/Surprise/,Neutral,0.415,Surprise,0.838
Ugxj5uGLwbuoL4YkNQV4AaABAg,SamanthaVimes,1 month ago,1510994172604,Lots of women don't wear makeup and keep having to put up with guys telling them how much better they would look if they used it.,5,true,11,,,,,,,/Negative/Hate/,Negative,0.384,Hate,0.245
,,,,,,,,Ugxj5uGLwbuoL4YkNQV4AaABAg.8_33y5tyf6r8_34uT5EPBO,Through The Smoke,1 month ago,1510994173154,"SamanthaVimes 

This never happens",1,/Negative/Hate/,Negative,0.643,Hate,0.262
,,,,,,,,Ugxj5uGLwbuoL4YkNQV4AaABAg.8_33y5tyf6r8_35U8kQNVJ,Im Ready To Settle Down Now,1 month ago,1510994173157,Never heard of that.,2,/Neutral/Surprise/,Neutral,0.49,Surprise,0.908
,,,,,,,,Ugxj5uGLwbuoL4YkNQV4AaABAg.8_33y5tyf6r8_35trI7tLj,ThePipeMonk,1 month ago,1510994173160,LOL yes because lots of women have naturally black colored eye lines lmao.,0,/Positive/Fun/,Positive,0.722,Fun,0.389
,,,,,,,,Ugxj5uGLwbuoL4YkNQV4AaABAg.8_33y5tyf6r8_36UFsMaRs,Hillary Cowan,1 month ago,1510994173162,"So true! Everytime I don’t wear eyeliner and mascara I’m asked if I’m sick or tired at the office. Nope those are just my beady little eyes, sorry. 🤩",1,/Negative/Worry/,Negative,0.544,Worry,0.229
,,,,,,,,Ugxj5uGLwbuoL4YkNQV4AaABAg.8_33y5tyf6r8_3BIJ82T2U,gunnyblender,1 month ago,1510994173165,I'm seen and/or been involved with that convo at least three times.. Guess the other males here are virgins.,0,/Neutral/Surprise/,Neutral,0.458,Surprise,0.765
,,,,,,,,Ugxj5uGLwbuoL4YkNQV4AaABAg.8_33y5tyf6r8_3Bzi8ckBX,Through The Smoke,1 month ago,1510994173168,"gunnyblender 

Bro guys constantly tell cunts to not wear makeup",0,/Neutral/Surprise/,Neutral,0.397,Surprise,0.686
,,,,,,,,Ugxj5uGLwbuoL4YkNQV4AaABAg.8_33y5tyf6r8_3FYBMCaMj,jesus barrera,1 month ago,1510994173171,"Hillary Cowan that's what happens when you give the first impression while wearing make up

They only know the you that wears makeup",0,/Positive/Enthusiasm/,Positive,0.374,Enthusiasm,0.347
,,,,,,,,Ugxj5uGLwbuoL4YkNQV4AaABAg.8_33y5tyf6r8_3GGKobbgl,Hillary Cowan,1 month ago,1510994173174,"jesus barrera true. I wear make up for myself, rather than other people, like fun earrings or a cute top. It’s just funny when guys make comments on anything about my looks as if they honestly can’t tell what’s make up or nature. It’s pretty obvious people don’t have naturally black lined eyelids and lashes.",0,/Positive/Fun/,Positive,0.556,Fun,0.239
,,,,,,,,Ugxj5uGLwbuoL4YkNQV4AaABAg.8_33y5tyf6r8_3JYb7GdxS,Star Citizen,1 month ago,1510994173177,"Well, slap on some clown make up if the only thing you are worried about is men finding you attractive......So much for the whole doing this so I feel better about myself argument....While you're at it get a nose job like Anna.",0,/Negative/Worry/,Negative,0.536,Worry,0.306
,,,,,,,,Ugxj5uGLwbuoL4YkNQV4AaABAg.8_33y5tyf6r8_3RpkmcgGF,gunnyblender,1 month ago,1510994173180,"Notice Smoke didn't caveat that with ""when they tell men to wait so they can put on make up."" ;p",0,/Negative/Hate/,Negative,0.515,Hate,0.23
,,,,,,,,Ugxj5uGLwbuoL4YkNQV4AaABAg.8_33y5tyf6r8_40fY64RJc,Jason Smith,1 month ago,1510994173182,SamanthaVimes those men are idiots,0,/Negative/Worry/,Negative,0.399,Worry,0.219
UgzXdHQ4-tl6dSJ5Ho94AaABAg,kg062007,1 month ago,1510994172608,hoes sweating bullets,4,true,1,,,,,,,/Neutral/Surprise/,Neutral,0.427,Surprise,0.51
,,,,,,,,UgzXdHQ4-tl6dSJ5Ho94AaABAg.8_33sPWHti68_3h9cTZBzy,Color Black,1 month ago,1510994172954,kg062007 😂😂,0,/Neutral/Empty tweets / Garbage / No sentiments/,Neutral,0.427,Empty tweets / Garbage / No sentiments,0.527
UgynSbFt122AcnMqSCh4AaABAg,Dan Don,1 month ago,1510994172614,Women wear so much make up man. They wear make up then add filters then add lighting to their pics on social media . You don't even know what these people really look like,6,true,2,,,,,,,/Positive/Fun/,Positive,0.363,Fun,0.234
,,,,,,,,UgynSbFt122AcnMqSCh4AaABAg.8_32n-2rN_-8_3D5iTUbsR,MrLeermeister,1 month ago,1510994173027,According to the App Anna looks like ODO the shape shifter from DS9,1,/Neutral/Surprise/,Neutral,0.367,Surprise,0.653
,,,,,,,,UgynSbFt122AcnMqSCh4AaABAg.8_32n-2rN_-8_4ZlVWBLmB,Jacqueline,1 month ago,1510994173030,"I agree. Pretty much all women filter their pics these days...though the more insecure ones over-filter to the point that their skin looks like its infected with jaundice and their food looks almost radioactive. Studies about social media indicate that people who filter their photos get more likes. So more realistic pictures are less popular, unfortunately.",0,/Positive/Relief/,Positive,0.475,Relief,0.281
UgxkpiJe2UEes0m9LG54AaABAg,B Marti,1 month ago,1510994172619,I own a muscle suit that I put on only to take selfies.,1,false,0,,,,,,,/Neutral/Surprise/,Neutral,0.479,Surprise,0.538
UgyGF8NHtbXGLyQPkEF4AaABAg,Thomas Oklahoma,1 month ago,1510994172625,"How would Tomi ""White Power Barbie"" Lahren look without makeup? 
How would Melania ""Illegal Immigrant"" Trump look with out makeup?",19,true,13,,,,,,,/Neutral/Surprise/,Neutral,0.402,Surprise,0.53
,,,,,,,,UgyGF8NHtbXGLyQPkEF4AaABAg.8_32085JFll8_34xZ77Vy5,Through The Smoke,1 month ago,1510994173215,"Thomas Oklahoma 

Both would look hot fam",4,/Neutral/Empty tweets / Garbage / No sentiments/,Neutral,0.431,Empty tweets / Garbage / No sentiments,0.665
,,,,,,,,UgyGF8NHtbXGLyQPkEF4AaABAg.8_32085JFll8_37AIDGopK,MRostendway,1 month ago,1510994173217,They would both look like bald cats.,8,/Negative/Worry/,Negative,0.433,Worry,0.288
,,,,,,,,UgyGF8NHtbXGLyQPkEF4AaABAg.8_32085JFll8_3AuLxiLkf,Thomas Oklahoma,1 month ago,1510994173220,"LOL, bald cats?",0,/Positive/Fun/,Positive,0.439,Fun,0.412
,,,,,,,,UgyGF8NHtbXGLyQPkEF4AaABAg.8_32085JFll8_4aW9HXcBI,David Digi,1 month ago,1510994173223,"Thomas Oklahoma find out for yourself, with this wonderful new app!",0,/Positive/Happiness/,Positive,0.408,Happiness,0.241
,,,,,,,,UgyGF8NHtbXGLyQPkEF4AaABAg.8_32085JFll8_4cxzrJaS2,MRostendway,1 month ago,1510994173226,Through The Smoke TRIGGERED,1,/Neutral/Surprise/,Neutral,0.532,Surprise,0.614
,,,,,,,,UgyGF8NHtbXGLyQPkEF4AaABAg.8_32085JFll8_4f7tyd8T-,Through The Smoke,1 month ago,1510994173228,"MRostendway 

Naw fam I just think black women are disgusting",1,/Neutral/Surprise/,Neutral,0.44,Surprise,0.661
,,,,,,,,UgyGF8NHtbXGLyQPkEF4AaABAg.8_32085JFll8_8VNQRBBvn,MRostendway,4 weeks ago,1511166973231,"Through The Smoke Thats ok. You are a white dude. You couldnt please a black woman. 
It takes a real man to appreciate and handle the beauty of melanin.
Thats why low test betamales tend to go after kids and revolting dogs like tomi lahren.

To each his own bruh! :)",0,/Positive/Relief/,Positive,0.476,Relief,0.273
