,,,,,,,,,,,,,,Classification path,Level 1 label,Level 1 probability
UgyA6xFwdvncmyednr14AaABAg,Zoe Kelly,1 month ago,1510599711363,I'd be happy if someone grabbed my ass. To me it would be a huge compliment. I sure as hell don't want to get raped but the occasional ass grab would be great for my self esteem.,3,true,1,,,,,,,/Negative/,Negative,0.807
,,,,,,,,UgyA6xFwdvncmyednr14AaABAg.8ZwKuFkN4_B8ZwZrXUDOv3,Konstantin Krastev,4 weeks ago,1510772511699,Go get groped then and leave it off for people who don't want to be assaulted.,0,/Negative/,Negative,0.961
UgzwctcQ4cqKdOOq3P14AaABAg,Jay Tee,1 month ago,1510599711367,Ana sounds very ILL as in ILL ary Rotten (to the core) Clinton who killed Seth Rich & Vince Foster & countless others,1,false,0,,,,,,,/Positive/,Positive,0.539
UgwoweX85ED7G2vUaj54AaABAg,d dave,1 month ago,1510599711371,16 is legal in Alabama.,1,true,4,,,,,,,/Neutral/,Neutral,0.805
,,,,,,,,UgwoweX85ED7G2vUaj54AaABAg.8ZwKR-MB3GQ8ZwKp_EEvm_,Hi Baby,1 month ago,1510599711833,d dave Dumbass this has nothing to do with Alabama,0,/Negative/,Negative,0.979
,,,,,,,,UgwoweX85ED7G2vUaj54AaABAg.8ZwKR-MB3GQ8ZwKrQB4hrc,Opinunate ted,1 month ago,1510599711836,If consensual. But how long has it been? It used to be 18.,0,/Neutral/,Neutral,0.607
,,,,,,,,UgwoweX85ED7G2vUaj54AaABAg.8ZwKR-MB3GQ8ZwKzKNpER0,d dave,1 month ago,1510599711838,Yes it does. They brought up Roy Moore.,0,/Positive/,Positive,0.994
,,,,,,,,UgwoweX85ED7G2vUaj54AaABAg.8ZwKR-MB3GQ8ZwNJmsGYYL,papaburger,1 month ago,1510599711840,why stop there ?  just get rid of minimum legal consent rules .   The world will have no pedophile .,0,/Negative/,Negative,0.512
UgwnvE7kJ3TYP-A-tPN4AaABAg,Alonzo Ibarra,1 month ago,1510599711375,"2017 will go down in the history books as ""The Year of Sexual Assaults"". This is too much.",9,true,2,,,,,,,/Negative/,Negative,0.732
,,,,,,,,UgwnvE7kJ3TYP-A-tPN4AaABAg.8ZwK0T3UAY48_0IHskKHVv,Kurtis C.,3 weeks ago,1511377311743,"This is the year that they were exposed, not committed.",0,/Positive/,Positive,0.523
,,,,,,,,UgwnvE7kJ3TYP-A-tPN4AaABAg.8ZwK0T3UAY48_0UGxsngfT,Alonzo Ibarra,3 weeks ago,1511377311747,Kurtis C. Yep. It's sad.,1,/Negative/,Negative,0.998
Ugw5hKNcgCyf8uPxUqh4AaABAg,Beef Chunks,1 month ago,1510599711379,I'm outraged... at Ana not showing those hot legs.,1,false,0,,,,,,,/Negative/,Negative,0.896
UgxGfFSjjzgacPaXoLZ4AaABAg,Jay Tee,1 month ago,1510599711382,No wonder he loves Slick Willie! All these old dying fast deep state assassins need to die asap while The Donald Makes America Great Again!!!!!!!!!!!!!!!!!!!!!!!!!!!!!!!!!!!!!!!!!!,1,false,0,,,,,,,/Positive/,Positive,0.977
UgwAOBO3J1gFHiwL9N14AaABAg,Jay Tee,1 month ago,1510599711384,What a Deep State Trump Hating JFK Killing CREEP!!!!!!!!!!!!!!!!!!!!!!!!!!,1,false,0,,,,,,,/Negative/,Negative,0.957
UgzvplkElUsMbgOlyTV4AaABAg,YoungNBoosted,1 month ago,1510599711387,It wasn't illegal back in the day when dinosaurs roamed.,1,false,0,,,,,,,/Negative/,Negative,0.922
UgwvzggwSqtKzDDfPXF4AaABAg,Matthew Norberg,1 month ago,1510599711390,"It's ""power you WIELD"", not ""YIELD"".",0,false,0,,,,,,,/Negative/,Negative,0.998
UgyvHOxvnXRMSVbbPp94AaABAg,farzad khadem,1 month ago,1510599711394,I have a feeling Ana is pregnant. We will know in 9 months.,5,false,0,,,,,,,/Positive/,Positive,0.697
UgwiGcxnkXdJ2gqOsTd4AaABAg,Iam2flycam awa,1 month ago,1510599711396,"Obviously he knows most morons will think like you cenk, ""oh I'm just an old man, I know not what I do"". Give me a break, he's a predator. Period.",2,false,0,,,,,,,/Negative/,Negative,0.803
Ugxx8BOeXwqS2j1RiKl4AaABAg,Wendy Adams,1 month ago,1510599711399,"Every person on here that responded with some sort of perverted response, I hope you don't have a daughter, a sister or a even a mother that this has ever happened to.  And if you do have a female in your life that you love and have respect for, I hope your comment didn't disrespect her dignity. And I can probably guarantee than any man who made light of this report has in some shape, form or fashion committed indiscretions similar to this. Thats the pathetic reason for the idiotic response you made.....birds of a feather....gather together.....and legitimatize their actions.....period!",1,false,0,,,,,,,/Negative/,Negative,0.758
Ugyjx9rD1oiXXrn0Gh14AaABAg,MyDude,1 month ago,1510599711402,I suspect alzheimer's/senility.,1,true,1,,,,,,,/Negative/,Negative,0.727
,,,,,,,,Ugyjx9rD1oiXXrn0Gh14AaABAg.8ZwJ5AhaGJW8ZwJNu_sxe3,Mark Twain,1 month ago,1510599711707,Such acting out is common with the condition.,0,/Negative/,Negative,0.934
UgwBSF5sEk85iFUYgWt4AaABAg,Ribb Rotgut,1 month ago,1510599712523,"what exactly is a ""ripe squeeze""?",0,false,0,,,,,,,/Positive/,Positive,0.998
UgyGi1wA5HX-jshwJ_14AaABAg,Gary Priestley,1 month ago,1510599712526,Sorry Cenk but you missed the mark on this one. There have been no consequences for GHWB over this repeated behaviour. He was either responsible for his actions or not. If not he's no better than a rabid dog left to harm others.,7,true,1,,,,,,,/Negative/,Negative,0.998
,,,,,,,,UgyGi1wA5HX-jshwJ_14AaABAg.8ZwJ2Ro-J8N8ZwKk909fVd,MRostendway,1 month ago,1510599712957,Gary Priestley He is tho. The guy is a dementing senile guy.,0,/Negative/,Negative,0.689
Ugzo6JW8gKk0eFV10_54AaABAg,GoldenEye50,1 month ago,1510599712530,"I'm biased too, he is the Bush I hated the least",3,false,0,,,,,,,/Negative/,Negative,0.988
Ugzbwdc4cnbVHUYNhg14AaABAg,jason618,1 month ago,1510599712534,I knew women 2 very beautiful beauty pageant women that swear that Hillary Clinton came on to them. wonder if that will ever come out.,0,true,1,,,,,,,/Positive/,Positive,0.869
,,,,,,,,Ugzbwdc4cnbVHUYNhg14AaABAg.8ZwIzu9FtaQ8ZwJHHcK2J0,Johnyliltoe,1 month ago,1510599712949,If Hillary Clinton groped them then I would recommend you support them in telling their story. It's their prerogative to come forward or not. No one sane is going to take such an allegation seriously from an internet commenter claiming something happened to a friend of theirs.,0,/Negative/,Negative,0.846
Ugwb7mbNufvsae8OERh4AaABAg,Dr. Manhattan,1 month ago,1510599712537,Anyone else e notice that cenk is ALWAYS the most conservative person in every tyt video?,1,true,3,,,,,,,/Positive/,Positive,0.896
,,,,,,,,Ugwb7mbNufvsae8OERh4AaABAg.8ZwIxMP1agF8ZwJNuMtqMZ,Johnyliltoe,1 month ago,1510599713114,"Yes, because he is. I don't think he's shy about pointing that out either. He's simply just more conservative than the people he hires.",0,/Negative/,Negative,0.986
,,,,,,,,Ugwb7mbNufvsae8OERh4AaABAg.8ZwIxMP1agF8ZwJq7eH93E,Brandon Smith,1 month ago,1510599713116,Johnyliltoe The only part where hes not conservative is where has a deep hatred for white people,0,/Negative/,Negative,0.916
,,,,,,,,Ugwb7mbNufvsae8OERh4AaABAg.8ZwIxMP1agF8ZwLb7uB5HR,Aisha Abdikarim,1 month ago,1510599713118,He used to be republican,1,/Negative/,Negative,0.896
UgzdpIsHezSfrj1R9yx4AaABAg,Dylan Thomas,1 month ago,1510599712541,What are you going to do.... put him in prison?! Nigga only got a few months left. Shit,2,false,0,,,,,,,/Negative/,Negative,0.754
UgyknbdDv1rhY4Apmn54AaABAg,Dee Gurz,1 month ago,1510599712544,A little disappointed with Ana in this clip. We all know sexual harassment  is bad. Can we please have a more nuanced discussion about it now?,3,true,4,,,,,,,/Negative/,Negative,0.873
,,,,,,,,UgyknbdDv1rhY4Apmn54AaABAg.8ZwIM0LZQeO8ZwJKtx0TFO,Dr. Manhattan,1 month ago,1510599712969,Like what?,0,/Positive/,Positive,0.885
,,,,,,,,UgyknbdDv1rhY4Apmn54AaABAg.8ZwIM0LZQeO8ZwKtMgpWCd,MRostendway,1 month ago,1510599712972,Dr. Manhattan Like how weinstein knowingly raping women is different from a senile dementing bush making david cop a feel jokes. Its not black and white.,1,/Negative/,Negative,0.635
,,,,,,,,UgyknbdDv1rhY4Apmn54AaABAg.8ZwIM0LZQeO8Zw_JJQzg3h,danzigvssartre,4 weeks ago,1510772512975,Who’s interested in nuanced discussion? Just give us the lurid details and we can cover up our voyeurism with righteousness moral outrage.,0,/Positive/,Positive,0.777
,,,,,,,,UgyknbdDv1rhY4Apmn54AaABAg.8ZwIM0LZQeO8Zw_ZITvN3l,Dr. Manhattan,4 weeks ago,1510772512978,Assault is assault. Groping is not innocent.,1,/Negative/,Negative,0.998
UgwTWodxsGlXG11J2E94AaABAg,r pray,1 month ago,1510599712548,"When someone gets up in age the chances that they have Dementia or Alzheimer's increases! My grandfather had Dementia, it made him beat people up, and go into other peoples' bedrooms to sleep. According to Ana a disease is no excuse. This is why I'm starting to hate TYT!",1,true,4,,,,,,,/Negative/,Negative,0.971
,,,,,,,,UgwTWodxsGlXG11J2E94AaABAg.8ZwI48esANw8ZwJOkhApL7,Dr. Manhattan,1 month ago,1510599713075,"You never liked tyt, troll.",0,/Positive/,Positive,1
,,,,,,,,UgwTWodxsGlXG11J2E94AaABAg.8ZwI48esANw8ZwWe9Co2lS,r pray,4 weeks ago,1510772513078,Dr. Manhattan I actually did used to like TYT; They've become shit tho.,0,/Negative/,Negative,0.678
,,,,,,,,UgwTWodxsGlXG11J2E94AaABAg.8ZwI48esANw8ZwYZejlQ5c,Dr. Manhattan,4 weeks ago,1510772513080,"Enunciate the differences, then.",0,/Neutral/,Neutral,0.807
,,,,,,,,UgwTWodxsGlXG11J2E94AaABAg.8ZwI48esANw8ZwkQ5sf46M,r pray,4 weeks ago,1510772513082,Watch earlier videos it's clear.,0,/Neutral/,Neutral,0.924
UgyThR5VUobDiVb8Re94AaABAg,dmndsol,1 month ago,1510599712559,"I'm 43 and I was taught, as soon as I started interacting with other children, KEEP YOUR HANDS TO YOURSELF!",0,false,0,,,,,,,/Negative/,Negative,0.828
UgzniDCSsvoCW9m8K3l4AaABAg,br0wnguy135,1 month ago,1510599712563,"Cenk's excuses for him being as old as a grandpa are just ridiculous. Hearing it from Ana's perspective really gets the point across that his age shouldn't be an excuse. Groping and sexual harassment is just wrong, it's just more astonishing and horrendous for a current or former President to be doing this",1,true,2,,,,,,,/Negative/,Negative,0.975
,,,,,,,,UgzniDCSsvoCW9m8K3l4AaABAg.8ZwHh1zpjRn8ZwIs_NsRVm,under_score,1 month ago,1510599713045,He actually said it wasn't an excuse multiple times and questioned if the distinction mattered at all.,2,/Negative/,Negative,0.998
,,,,,,,,UgzniDCSsvoCW9m8K3l4AaABAg.8ZwHh1zpjRn8ZxQgug2R5J,br0wnguy135,4 weeks ago,1510772513048,"+under_score Yeah you're right. But it did seem almost like excuses as he was downplaying Bush's actions because of his age. I wonder if there were other cases of this happening, especially when Bush was younger",0,/Negative/,Negative,0.527
UgwHg4SlJndWU00u9M94AaABAg,Owen Menard,1 month ago,1510599712569,rap culture exists only in Hollywood. Everywhere else sexual abuse is shunned,0,true,2,,,,,,,/Positive/,Positive,0.68
,,,,,,,,UgwHg4SlJndWU00u9M94AaABAg.8ZwHcsEOSO88ZwJVZ4i755,Dr. Manhattan,1 month ago,1510599713101,RAP CULTURE hahahahahahahahaha,1,/Positive/,Positive,0.455
,,,,,,,,UgwHg4SlJndWU00u9M94AaABAg.8ZwHcsEOSO88ZwJZbq8PeW,Dr. Manhattan,1 month ago,1510599713103,Not in proximity to republicans apparently.,1,/Negative/,Negative,0.984
UgxSUAnpTWDv58rxKZF4AaABAg,Drakilicious,1 month ago,1510599712573,"She'll mysteriously die of a suicide or in an accident. ... ""suicide by three shots to the back of the head""",3,false,0,,,,,,,/Negative/,Negative,0.961
Ugyr4wfvMFyo4jWDVXx4AaABAg,Jason Smith,1 month ago,1510599712576,"Grab em






By the Bush",26,true,2,,,,,,,/Negative/,Negative,0.939
,,,,,,,,Ugyr4wfvMFyo4jWDVXx4AaABAg.8ZwHLg7VyUJ8ZxSHcZwOzR,Crimson King,4 weeks ago,1510772513090,"Jason Smith Here, take my 👍👍👍👍👍",0,/Positive/,Positive,0.984
,,,,,,,,Ugyr4wfvMFyo4jWDVXx4AaABAg.8ZwHLg7VyUJ8ZyZZr5PKF5,Cary Pollack,4 weeks ago,1510772513092,"King  Crimson/The Greastest Progressive R&R Band {So they Say},",0,/Positive/,Positive,0.637
UgwdTyIGVLaN1_aKWKJ4AaABAg,Naveen Kumar,1 month ago,1510599712580,This is what they get for idolizing psychopaths just for being famous. Educate your kids better.,1,true,1,,,,,,,/Positive/,Positive,0.781
,,,,,,,,UgwdTyIGVLaN1_aKWKJ4AaABAg.8ZwHFsDRDEj8ZwJdrUa8Kq,Dr. Manhattan,1 month ago,1510599712994,Who is idolizing whom?,0,/Negative/,Negative,0.502
UgywluRmNU9o0AB30Cp4AaABAg,The Great Imposter,1 month ago,1510599712585,"Hey Ana, how about mentioning drunk chicks who grab guys by their private parts. it happens quite frequently but you seem to conveniently not want to acknowledge that because it's different- right?",0,true,9,,,,,,,/Negative/,Negative,0.527
,,,,,,,,UgywluRmNU9o0AB30Cp4AaABAg.8ZwHBtg-5bp8ZwJ5h2-wNw,KingTekins,1 month ago,1510599713142,Lmao a tranny grabbed my dick at a club in Tokyo.,0,/Positive/,Positive,0.555
,,,,,,,,UgywluRmNU9o0AB30Cp4AaABAg.8ZwHBtg-5bp8ZwJNgo_GmV,Tusker Doodle,1 month ago,1510599713144,The Great Imposter - She didn’t talk about men getting groped because the story was about women getting groped.,0,/Positive/,Positive,0.873
,,,,,,,,UgywluRmNU9o0AB30Cp4AaABAg.8ZwHBtg-5bp8ZwL-R8kIoz,Frahamen,1 month ago,1510599713147,What about not muddying the water?,0,/Negative/,Negative,0.986
,,,,,,,,UgywluRmNU9o0AB30Cp4AaABAg.8ZwHBtg-5bp8ZwLIfjjF3C,LizzyLiberty,1 month ago,1510599713150,"If you're traumatized by drunk chicks grabbing your male private parts, please report to the police, who are 92% male so you will be guaranteed a safe space to cry about your feelings.",0,/Negative/,Negative,0.479
,,,,,,,,UgywluRmNU9o0AB30Cp4AaABAg.8ZwHBtg-5bp8ZwLdtJqs0B,Alejandro Nopasanada,1 month ago,1510599713152,What about people who urinate on the seat and don’t wipe up.,0,/Negative/,Negative,0.979
,,,,,,,,UgywluRmNU9o0AB30Cp4AaABAg.8ZwHBtg-5bp8ZwMItivdt3,Jason Smith,1 month ago,1510599713154,"LizzyLiberty I think he stated a moral fallacy, but nonetheless doenst delegitimize his personal rights either. Plus men are believed or are taken seriously at all. Your statement proves that. Anyways both happen and clearly one is worse for the other.",0,/Negative/,Negative,0.99
,,,,,,,,UgywluRmNU9o0AB30Cp4AaABAg.8ZwHBtg-5bp8ZwO_OMeY6u,Frahamen,1 month ago,1510599713156,What about Bill oReilly?,0,/Neutral/,Neutral,0.98
,,,,,,,,UgywluRmNU9o0AB30Cp4AaABAg.8ZwHBtg-5bp8ZwSe71j9-i,LizzyLiberty,1 month ago,1510599713159,Jason - nothing I said 'delegitimized his personal right'. But keep vilifying any random women and make men the biggest victims on this planet. Then see a therapist one day to talk about your mother.,0,/Negative/,Negative,0.977
,,,,,,,,UgywluRmNU9o0AB30Cp4AaABAg.8ZwHBtg-5bp8ZwygdGYEga,Jason Smith,4 weeks ago,1510772513162,"LizzyLiberty 1. no one was villifying random women, only those who commit the acts, or making men the biggest victims only those violated. Again, distinction matters. 
2. No need for the ad hominem masquerading as arm chair psychology.
 3. Congrats on winning the gold medal of oppression olympics rather than empathizing with all victims and engaging in meaningful dialogue.",0,/Negative/,Negative,0.689
UgzQHpJ7ouRWMdhkt5V4AaABAg,Cecil Lyles,1 month ago,1510599712589,"I would like to know more about the phone call that Bush made to Trump about waiting to release the information on the JFK assassination! Bush was involved in the murder, in fact, there is a picture of him standing about 6 or so feet from Oswald at the entrance to the book depository! Why would Bush be so worried about what might be in those papers?",2,true,3,,,,,,,/Negative/,Negative,0.73
,,,,,,,,UgzQHpJ7ouRWMdhkt5V4AaABAg.8ZwH6bLtoAo8ZwHtKWjyFU,Fadi Yashouh,1 month ago,1510599713058,Cecil Lyles is it true that Bush Sr called Trump about the release of the JFK files? That is a pretty big deal . I haven't heard that anywhere as of yet.,1,/Negative/,Negative,0.52
,,,,,,,,UgzQHpJ7ouRWMdhkt5V4AaABAg.8ZwH6bLtoAo8ZwJriM89wS,Dr. Manhattan,1 month ago,1510599713060,Link the photo or it didnt happen.,0,/Negative/,Negative,0.957
,,,,,,,,UgzQHpJ7ouRWMdhkt5V4AaABAg.8ZwH6bLtoAo8ZwPuDs6pxN,Paradise Care Services,1 month ago,1510599713063,"Cecil Lyles  totally agree, mate",0,/Positive/,Positive,0.686
UgyVo9zWYx81E9LQ3sd4AaABAg,Larry Menasco,1 month ago,1510599712594,Do you think he did it to cop a feel or to get a reaction as the camera clicked?,0,true,1,,,,,,,/Negative/,Negative,0.746
,,,,,,,,UgyVo9zWYx81E9LQ3sd4AaABAg.8ZwGqDdRQt68ZwJu6kFWSo,Dr. Manhattan,1 month ago,1510599713015,Thats the same thing.,0,/Negative/,Negative,0.627
UgzzHwHzmmEVaqaxikV4AaABAg,J Thom,1 month ago,1510599712598,I dunno. . . I'm kinda smiling here glad at the idea that POTUS41 is a butt-man.,1,true,2,,,,,,,/Positive/,Positive,0.969
,,,,,,,,UgzzHwHzmmEVaqaxikV4AaABAg.8ZwGmnz2zQH8ZwJzqN_NOT,Dr. Manhattan,1 month ago,1510599713006,You are advocating child molestation. You need help.,0,/Negative/,Negative,0.896
,,,,,,,,UgzzHwHzmmEVaqaxikV4AaABAg.8ZwGmnz2zQH8ZwjEuD55sh,J Thom,4 weeks ago,1510772513009,Maybe. Cant lie. heh-heh.,0,/Negative/,Negative,0.615
UgyyhgSFzeDhyjxJDo54AaABAg,Kat Sam,1 month ago,1510599712602,Still no mention of the George Takei sexual assaults.,2,true,3,,,,,,,/Negative/,Negative,0.984
,,,,,,,,UgyyhgSFzeDhyjxJDo54AaABAg.8ZwG_Y55Uuw8ZwJ7vKmLuH,KingTekins,1 month ago,1510599713031,oh leave him alone,0,/Negative/,Negative,0.977
,,,,,,,,UgyyhgSFzeDhyjxJDo54AaABAg.8ZwG_Y55Uuw8ZwKrecHpAB,HarshDude126,1 month ago,1510599713034,So?,1,/Negative/,Negative,0.932
,,,,,,,,UgyyhgSFzeDhyjxJDo54AaABAg.8ZwG_Y55Uuw8ZwLS1XXAxf,LizzyLiberty,1 month ago,1510599713036,"Takei accuser is a joke, make a mockery out of real male on male assault reports.",0,/Negative/,Negative,0.99
UgwfCAPyCZ7yneK1Krt4AaABAg,John Blazem,1 month ago,1510599712606,its what people do in politics.. and you retards defend these morons.,2,true,1,,,,,,,/Positive/,Positive,0.986
,,,,,,,,UgwfCAPyCZ7yneK1Krt4AaABAg.8ZwGJe-4btt8ZwK1pPyCGU,Dr. Manhattan,1 month ago,1510599712985,Who defends them?,0,/Neutral/,Neutral,0.67
Ugz0SAtvnwAY1J2I0sp4AaABAg,Dannosuke25,1 month ago,1510599714082,He probably has dementia.,1,true,1,,,,,,,/Positive/,Positive,0.867
,,,,,,,,Ugz0SAtvnwAY1J2I0sp4AaABAg.8ZwGFXss9058ZwK4Z35GcP,Dr. Manhattan,1 month ago,1510599714531,"Not a valid excuse, dont use it as one.",0,/Negative/,Negative,0.996
UgxPb8cAgbnJNMISkqx4AaABAg,DemoKKKrats are SCUM,1 month ago,1510599714086,TFW everyone who supported Hillary turns out to be an abuser of women - Ana's perfectly fine with hiding sex abuse crimes until it no longer fits her narrative - disgusting.,1,true,1,,,,,,,/Negative/,Negative,0.719
,,,,,,,,UgxPb8cAgbnJNMISkqx4AaABAg.8ZwG4-WRs3X8ZwGS-G87-p,Cory Herbert,1 month ago,1510599714516,DemoKKKrats are SCUM lol yah you jist elected your abuser of women to the presidency instead.,1,/Negative/,Negative,0.855
UgzQWwVr-NBvP-CHDhh4AaABAg,Geoff Gyro,1 month ago,1510599714091,A pat on the bum isn’t assault.,1,true,13,,,,,,,/Negative/,Negative,0.83
,,,,,,,,UgzQWwVr-NBvP-CHDhh4AaABAg.8ZwG-xMBlWk8ZwGBDLntds,Logic beats Speculation,1 month ago,1510599714625,nearly every football player would be a victim.,1,/Negative/,Negative,0.99
,,,,,,,,UgzQWwVr-NBvP-CHDhh4AaABAg.8ZwG-xMBlWk8ZwHmGg5Frj,Drakilicious,1 month ago,1510599714629,I know right?,0,/Neutral/,Neutral,0.998
,,,,,,,,UgzQWwVr-NBvP-CHDhh4AaABAg.8ZwG-xMBlWk8ZwJCGmcoGY,KingTekins,1 month ago,1510599714635,it's a gesture of respect,0,/Positive/,Positive,0.795
,,,,,,,,UgzQWwVr-NBvP-CHDhh4AaABAg.8ZwG-xMBlWk8ZwJgD9P3SJ,Nikki G,1 month ago,1510599714639,If you have done that to anyone you should be in jail,2,/Negative/,Negative,0.812
,,,,,,,,UgzQWwVr-NBvP-CHDhh4AaABAg.8ZwG-xMBlWk8ZwKGMdRUWD,Dr. Manhattan,1 month ago,1510599714642,"It is. And, when they are underage it is child molestation. He, dictionary and legal definition, molested her. Look the word up.",3,/Negative/,Negative,0.9
,,,,,,,,UgzQWwVr-NBvP-CHDhh4AaABAg.8ZwG-xMBlWk8ZwNKLk-mS8,Geoff Gyro,1 month ago,1510599714647,"Nikki G -jail? I didn’t say stick a dick in her ass without permission is ok. 
A pat on the ass isn’t sexual assault.",0,/Negative/,Negative,0.979
,,,,,,,,UgzQWwVr-NBvP-CHDhh4AaABAg.8ZwG-xMBlWk8ZwOCzeb3FB,Nikki G,1 month ago,1510599714652,"Geoff Gyro Yes it is. ""The legal term sexual assault refers to any sexual contact that occurs without the express consent of the recipient.""",1,/Negative/,Negative,0.48
,,,,,,,,UgzQWwVr-NBvP-CHDhh4AaABAg.8ZwG-xMBlWk8ZwObwg3-t5,Nikki G,1 month ago,1510599714655,Geoff Gyro And sticking a dick in her ass would be rape you idiot,1,/Negative/,Negative,0.992
,,,,,,,,UgzQWwVr-NBvP-CHDhh4AaABAg.8ZwG-xMBlWk8ZwPu9Hg_OJ,Geoff Gyro,1 month ago,1510599714660,Nikki G Since when does a pat on the rump been sex?,0,/Neutral/,Neutral,0.355
,,,,,,,,UgzQWwVr-NBvP-CHDhh4AaABAg.8ZwG-xMBlWk8ZwQ2IzlpXp,Geoff Gyro,1 month ago,1510599714663,"Nikki G -agreed. Sticking a dick in without permission is assault. I suppose that patting her ass with a dick is sex assault too. 
A pat  on the bum is not.",0,/Negative/,Negative,0.941
,,,,,,,,UgzQWwVr-NBvP-CHDhh4AaABAg.8ZwG-xMBlWk8ZwR4iXiX5g,Dr. Manhattan,1 month ago,1510599714667,He groped her. That IS sexual.,0,/Positive/,Positive,0.566
,,,,,,,,UgzQWwVr-NBvP-CHDhh4AaABAg.8ZwG-xMBlWk8ZwTwhu41yv,Nikki G,4 weeks ago,1510772514671,Geoff Gyro You're clearly not a lawyer,0,/Negative/,Negative,0.99
,,,,,,,,UgzQWwVr-NBvP-CHDhh4AaABAg.8ZwG-xMBlWk8ZwUJ11fV51,Dr. Manhattan,4 weeks ago,1510772514676,"Worse yet, if he thinks that that is not a problem, he, himself, has likely done similar and is justifying his our actions. He cant admit that its wrong without admitting that what he had done is wrong.",0,/Negative/,Negative,0.682
UgxDDOcUiTCdRQxaIjh4AaABAg,EnderZ13,1 month ago,1510599714096,"If your punch line is ""David Cop-a-feel"" you should never be viewed as ""OK"" or a ""product of [his/her] time."" Times have changed, civilization has moved on.",1,false,0,,,,,,,/Negative/,Negative,0.729
UgzrD1QMq-_cAVCyh1h4AaABAg,edward hickey,1 month ago,1510599714098,"I give the old Bush a pass, grab buts when ever you can get away with it",6,true,4,,,,,,,/Positive/,Positive,0.941
,,,,,,,,UgzrD1QMq-_cAVCyh1h4AaABAg.8ZwFhyXO6vJ8ZwG2JwkPe-,Roy King.,1 month ago,1510599714826,you're the worst.,0,/Negative/,Negative,1
,,,,,,,,UgzrD1QMq-_cAVCyh1h4AaABAg.8ZwFhyXO6vJ8ZwGZR7tjNT,edward hickey,1 month ago,1510599714828,:),0,/Positive/,Positive,1
,,,,,,,,UgzrD1QMq-_cAVCyh1h4AaABAg.8ZwFhyXO6vJ8ZwKM0zTTgu,Dr. Manhattan,1 month ago,1510599714831,"So then, you advocate the sexual abuse of children.",0,/Negative/,Negative,0.648
,,,,,,,,UgzrD1QMq-_cAVCyh1h4AaABAg.8ZwFhyXO6vJ8ZwzzbjZhmi,edward hickey,4 weeks ago,1510772514833,Snowflakes overreacting again,1,/Negative/,Negative,0.963
Ugxzc1VogukQhVrDcXh4AaABAg,Jane Lin,1 month ago,1510599714102,The Family Values Party.,3,true,1,,,,,,,/Positive/,Positive,0.916
,,,,,,,,Ugxzc1VogukQhVrDcXh4AaABAg.8ZwFgEZ8VCY8ZwKNFQYxOj,Dr. Manhattan,1 month ago,1510599714455,IKR?,0,/Positive/,Positive,0.916
UgyZYSm3-SR6wUkndQ14AaABAg,Denis Oliver,1 month ago,1510599714106,She should have considered it an honour to have had her butt groped by an ex-president.,2,true,2,,,,,,,/Negative/,Negative,0.92
,,,,,,,,UgyZYSm3-SR6wUkndQ14AaABAg.8ZwFdVrGQJr8ZwKRE1NmD5,Dr. Manhattan,1 month ago,1510599714558,You advocate the sexual abuse of children.,0,/Positive/,Positive,0.711
,,,,,,,,UgyZYSm3-SR6wUkndQ14AaABAg.8ZwFdVrGQJr8ZwKX1dxhUi,Dr. Manhattan,1 month ago,1510599714562,"She isnt old enough to consent, nor was she given the opportunity to. Assault is assault.",0,/Negative/,Negative,0.637
UgzRV0gY0giCrSwaYdR4AaABAg,Chad Valane,1 month ago,1510599714110,Bush party's are probably off the chain,1,false,0,,,,,,,/Positive/,Positive,0.629
UgxfRBaWMs0Gr6tNq4t4AaABAg,Luis Martinez,1 month ago,1510599714113,Let the Republican base get destroyed one by one with this sexual cases.,2,false,0,,,,,,,/Negative/,Negative,0.924
UgwOLyY2_Bg4w603IcV4AaABAg,juan gomez,1 month ago,1510599714116,GOP=Great Old Pedophiles,4,true,3,,,,,,,/Positive/,Positive,0.984
,,,,,,,,UgwOLyY2_Bg4w603IcV4AaABAg.8ZwFQiNvAGS8ZwFdHCI4xM,The Inquisitor,1 month ago,1510599714506,juan gomez grand*. Lmao,0,/Negative/,Negative,0.566
,,,,,,,,UgwOLyY2_Bg4w603IcV4AaABAg.8ZwFQiNvAGS8ZwG03MK8QB,ze d,1 month ago,1510599714508,juan gomez lol,0,/Positive/,Positive,0.865
,,,,,,,,UgwOLyY2_Bg4w603IcV4AaABAg.8ZwFQiNvAGS8ZwQ9ST0diw,Paradise Care Services,1 month ago,1510599714510,juan gomez ...Gross Old Peedoes,0,/Positive/,Positive,0.98
UgwAVtVAXD7ucpwVkZR4AaABAg,"Sacred, Nothing is",1 month ago,1510599714119,Man the false rape accusations have been sky rocketing.,1,true,1,,,,,,,/Negative/,Negative,0.879
,,,,,,,,UgwAVtVAXD7ucpwVkZR4AaABAg.8ZwFEDdsqFe8ZwKgF0a2kz,Dr. Manhattan,1 month ago,1510599714493,"Is this what you expected out of your life? Outside looking in, it looks pathetic.",0,/Negative/,Negative,0.979
Ugw932V9i4F7uPpXXQ14AaABAg,snipervictim,1 month ago,1510599714123,Ana sometimes a ass grab is just a Ass grab I am a man I have had women grab my ass a lot and it was not the end of the world let it go.,13,true,8,,,,,,,/Positive/,Positive,0.557
,,,,,,,,Ugw932V9i4F7uPpXXQ14AaABAg.8ZwFCVhF3WD8ZwFleNUKJl,Jane Lin,1 month ago,1510599714781,"She was SIXTEEN years old, ya freak.",20,/Positive/,Positive,0.953
,,,,,,,,Ugw932V9i4F7uPpXXQ14AaABAg.8ZwFCVhF3WD8ZwJrvyoXXx,Nikki G,1 month ago,1510599714784,"An ass grab with permission is fine, but you're not entitled to just see an ass that you like and grab it. If you do, you should be in jail",14,/Negative/,Negative,0.881
,,,,,,,,Ugw932V9i4F7uPpXXQ14AaABAg.8ZwFCVhF3WD8ZwKkqxWHMx,Dr. Manhattan,1 month ago,1510599714788,You are an advocate of sexual assault.,11,/Negative/,Negative,0.98
,,,,,,,,Ugw932V9i4F7uPpXXQ14AaABAg.8ZwFCVhF3WD8ZwOd9oykB8,Guernicaman,1 month ago,1510599714794,"It depends if you're close friends w/the person & you wanna shock or surprise them...That's one thing. But if you're an old man grabbing a 16 year old's ass, it's totally not ok. That's borderline sexual assault.",1,/Positive/,Positive,0.586
,,,,,,,,Ugw932V9i4F7uPpXXQ14AaABAg.8ZwFCVhF3WD8ZweGhRvX4Y,Dr. Manhattan,4 weeks ago,1510772514798,Why are they only women then? Your position is ludicrous on its face.,5,/Negative/,Negative,0.998
