,,,,,,,,,,,,,,Classification path,Level 1 label,Level 1 probability
Ugyf0UOHPX5a7RfYwuN4AaABAg,Blackatchaproduction,1 month ago,1510997152310,The idiot doesn't care about policy and or relations with anyone. Unless the policy is for someone to kiss his ass,0,true,3,,,,,,,/Negative/,Negative,0.996
,,,,,,,,Ugyf0UOHPX5a7RfYwuN4AaABAg.8_1nuMWr-Ry8_1ueenkz4W,Europa H2O Alien,1 month ago,1510997152663,Would you like a tissue?,1,/Negative/,Negative,0.982
,,,,,,,,Ugyf0UOHPX5a7RfYwuN4AaABAg.8_1nuMWr-Ry8_37whlvMy3,Blackatchaproduction,1 month ago,1510997152667,Europa H2O Alien shitty troll response,0,/Negative/,Negative,0.998
,,,,,,,,Ugyf0UOHPX5a7RfYwuN4AaABAg.8_1nuMWr-Ry8_3R-m-obu_,Europa H2O Alien,1 month ago,1510997152669,Would you like a tissue?,0,/Negative/,Negative,0.982
Ugzf1QfVGl-q9sZ5ewN4AaABAg,Yahweh Rules2,1 month ago,1510997152314,"DEMONS IN CLONED TRANSEXUAL BODIES, YAHWEH RULES2 CHANNEL, MY CHANNEL",0,true,3,,,,,,,/Negative/,Negative,0.918
,,,,,,,,Ugzf1QfVGl-q9sZ5ewN4AaABAg.8_1nOnMpRxQ8_1nmzewo2q,DOC GREEN,1 month ago,1510997152647,Yahweh Rules2 You're insane.,1,/Positive/,Positive,0.916
,,,,,,,,Ugzf1QfVGl-q9sZ5ewN4AaABAg.8_1nOnMpRxQ8_1rRHGriRz,postmodern loser,1 month ago,1510997152650,Yahweh Rules2 what are you gay?,0,/Neutral/,Neutral,0.986
,,,,,,,,Ugzf1QfVGl-q9sZ5ewN4AaABAg.8_1nOnMpRxQ8_1tx5z28xR,HaLfCrAzEdCaNuCk,1 month ago,1510997152652,Then why doesn't that magical fairy you worship do something about it?,0,/Negative/,Negative,0.992
UgzChVkHnaTvkhENixh4AaABAg,jack johnson,1 month ago,1510997152318,"It`s time for these countries to fight their OWN battles and STOP sucking our young men and women into STUPID conflicts like our last 2 Presidents have done.
FINALLY a president that GETS IT....thank you Pres. TRUMP.",1,true,5,,,,,,,/Positive/,Positive,0.918
,,,,,,,,UgzChVkHnaTvkhENixh4AaABAg.8_1mhD63dQT8_1ri6Qj1j3,Jimmy C,1 month ago,1510997152755,Troll,0,/Negative/,Negative,0.488
,,,,,,,,UgzChVkHnaTvkhENixh4AaABAg.8_1mhD63dQT8_1tmt28k2s,jack johnson,1 month ago,1510997152757,MORON,0,/Negative/,Negative,0.488
,,,,,,,,UgzChVkHnaTvkhENixh4AaABAg.8_1mhD63dQT8_1uOAQW4ln,HaLfCrAzEdCaNuCk,1 month ago,1510997152759,As long as they fight their own battles with 'merican weapons right?Gotta keep that $$ rolling in somehow.,0,/Positive/,Positive,0.924
,,,,,,,,UgzChVkHnaTvkhENixh4AaABAg.8_1mhD63dQT8_1w1k2IccE,jack johnson,1 month ago,1510997152762,"That`s what we call a...WIN WIN situation.
It`s better than doing what Ovomit did by arming ""moderate Syrian rebels"" who later turned into ISIS.",0,/Negative/,Negative,0.65
,,,,,,,,UgzChVkHnaTvkhENixh4AaABAg.8_1mhD63dQT8_27lUxHyZt,U Swoor,1 month ago,1510997152764,"Actually, I don't think the US allowed Japan to have an army after WW2. The same thing with Germany. Also, you Trump people are against American military presence in other countries, I can understand that, I feel the same way, but you're also against diplomacy and multilateral agreements. What's the thinking there?",0,/Negative/,Negative,0.711
UgzW47tnKoD_dGLSAbF4AaABAg,Henry Townshed,1 month ago,1510997152321,"We are not the most richest nation in the world where do you get that did you know less than half the population of the United States made less than $15,000 last year I pay more in taxes",1,false,0,,,,,,,/Negative/,Negative,0.676
UgwYmGZE_pETml4TqnF4AaABAg,FABRICE KENNO,1 month ago,1510997152324,"What about those UCLA Black basketball players TYT? Had it not been for Trump, these players were expecting 10 years in Chinese prison for shoplifting. They’re taking a “KNEE DISRESPECTING THEIR COUNTRY,” when in fact their leader goes to foreign soil and begs for their release. It’s so sad how retarded libtards think!!",1,true,3,,,,,,,/Negative/,Negative,0.807
,,,,,,,,UgwYmGZE_pETml4TqnF4AaABAg.8_1lxsEFMie8_1myvLngP5,Henry Townshed,1 month ago,1510997152679,FABRICE KENNO the only reason why I Trump let those kids out is because he didn't want them ending up like Otto.  Personally I will let them rot,1,/Negative/,Negative,0.877
,,,,,,,,UgwYmGZE_pETml4TqnF4AaABAg.8_1lxsEFMie8_1ndJw-C4x,FABRICE KENNO,1 month ago,1510997152682,"Henry, i couldn't agree more!!!",0,/Negative/,Negative,0.996
,,,,,,,,UgwYmGZE_pETml4TqnF4AaABAg.8_1lxsEFMie8_1o-yTbGvt,Blackatchaproduction,1 month ago,1510997152684,FABRICE KENNO he didn't do anything,0,/Negative/,Negative,0.998
Ugwd_I6-jKxst7ghMcl4AaABAg,MamaMysteriouspgh,1 month ago,1510997152328,"Trump is trying to dump all the hardware that the  Industrial military complex has been stockpiling.... because we've been quietly putting money into more technical forms of mass destruction, like smarter, killer drones.",2,false,0,,,,,,,/Negative/,Negative,0.973
UgziIEIfFPLupMlad5B4AaABAg,Alyssa Celestino,1 month ago,1510997152331,"Love this panel, and so happy to see Ana!!!!",3,false,0,,,,,,,/Positive/,Positive,1
UgwCttGmZ7lwt3qU6MB4AaABAg,Gary Witherspoon,1 month ago,1510997152334,"Trump Trophy Hunters Annon.  The heads of this Administration, its Cabinet, and the 115th Republican Congress have declared the causes which impel them to separate the political bands connecting US society.",1,false,0,,,,,,,/Positive/,Positive,0.814
UgxtGlaedXO9qTeD_oR4AaABAg,Narratives of Old,1 month ago,1510997152337,"AMERICAN WEAPONS=  POWER AND CONTROL .. that is trump message... that, is what is all about.. its called DICTATORSHIP ..",4,false,0,,,,,,,/Positive/,Positive,0.824
UgynTSSavJuNkyWFvx14AaABAg,miapdx,1 month ago,1510997152340,"After a campaign that demonized Muslims, the first thing trump did in office, was RUN to the House of Saud, and bless them with 110 BILLION American dollars. For their military. Learn to speak Arabic.
America first? No. Saudi Arabia first. That's trump.",18,true,1,,,,,,,/Negative/,Negative,0.482
,,,,,,,,UgynTSSavJuNkyWFvx14AaABAg.8_1hBBs8bH18_2HMK8ImcR,SIRRICHARD THETAYLOR,1 month ago,1510997152700,"And they are not part of his Muslim ban, weird really as most of the 9/11 terrorists were Saudi, bin Larsen was Saudi, and the country worships the most extreme form of the Koran...",3,/Negative/,Negative,0.697
Ugw4zu4Zdo46ThdooVt4AaABAg,Spartan155,1 month ago,1510997153502,What would conservatives say if Obama sold weapons to Vietnam lol,7,true,3,,,,,,,/Neutral/,Neutral,0.875
,,,,,,,,Ugw4zu4Zdo46ThdooVt4AaABAg.8_1gaweyQxx8_1nr_Q-GgT,EwE Whisperer,1 month ago,1510997154102,Same things they did when obama armed mexican cartels and isis/daesh?,2,/Positive/,Positive,0.51
,,,,,,,,Ugw4zu4Zdo46ThdooVt4AaABAg.8_1gaweyQxx8_1urzMW9Q6,Europa H2O Alien,1 month ago,1510997154106,"Obama sold enriched uranium to Russia, . . .as you were saying?",0,/Neutral/,Neutral,0.676
,,,,,,,,Ugw4zu4Zdo46ThdooVt4AaABAg.8_1gaweyQxx8_1z2BIWaRS,EwE Whisperer,1 month ago,1510997154108,tune in to DIO all the fools sailed away     after the KING of metal sings you a lullaBY get at me.,0,/Positive/,Positive,0.746
UgwvLKfLjVtTMUvB6Ex4AaABAg,LegendLength,1 month ago,1510997153506,Let's see how the Franken story gets spun,2,true,3,,,,,,,/Positive/,Positive,0.848
,,,,,,,,UgwvLKfLjVtTMUvB6Ex4AaABAg.8_1gQ9Cistq8_1kMjNpjmc,Vikki Looper,1 month ago,1510997153954,LegendLength they will call Democrats out just like Republicans. Go troll elsewhere,2,/Negative/,Negative,0.855
,,,,,,,,UgwvLKfLjVtTMUvB6Ex4AaABAg.8_1gQ9Cistq8_1nyEGUvde,hewtwo,1 month ago,1510997153956,pffft Really...Expressing cynicism toward TyT for spinning a story is not trolling. It's almost a fact pattern at this point. -One IND's POV.,1,/Negative/,Negative,0.875
,,,,,,,,UgwvLKfLjVtTMUvB6Ex4AaABAg.8_1gQ9Cistq8_1oIW53en_,Mausome,1 month ago,1510997153958,Vikki Looper CNN's not even even reporting it. There's an actually  picture of Al Franken groping a woman's breasts while she was sleeping or drugged. Do you think that's okay because he's a Democrat?,1,/Negative/,Negative,0.994
Ugw8SszMal5wWeo9qLh4AaABAg,Dude Yoyo,1 month ago,1510997153510,"""We are know that Trump is planning on running for re-election."" Well that's a 180! Chenks bet that he was not going to get thru his first term in office. Now we are talking Re-election!?",0,true,1,,,,,,,/Negative/,Negative,0.732
,,,,,,,,Ugw8SszMal5wWeo9qLh4AaABAg.8_1gKxnbs1M8_1i3_BkC0e,SIXITHS,1 month ago,1510997153864,"Thinking that Trump is planning to run for re-election, and also thinking that he will be unable to complete his first term are not contradictory positions. They are talking about his intentions.",1,/Negative/,Negative,0.906
UgzuC7uB9MJTtJE1KdR4AaABAg,Tesco Tesco,1 month ago,1510997153514,"Selling weapons to allies, HOW DARE HE!",2,true,12,,,,,,,/Negative/,Negative,0.477
,,,,,,,,UgzuC7uB9MJTtJE1KdR4AaABAg.8_1fU7w_yNP8_1fsrHY0CH,deznuts3000,1 month ago,1510997154006,"check your fact moron, when was China a US ally?",4,/Neutral/,Neutral,0.648
,,,,,,,,UgzuC7uB9MJTtJE1KdR4AaABAg.8_1fU7w_yNP8_1gBOH3mSz,samiamrg7,1 month ago,1510997154008,"Yeah, Vietnam is totally our ally. :P",0,/Positive/,Positive,0.648
,,,,,,,,UgzuC7uB9MJTtJE1KdR4AaABAg.8_1fU7w_yNP8_1gEV9FTSr,Sterling,1 month ago,1510997154011,Since Nixon opened up trade with China in the 1970s,0,/Neutral/,Neutral,0.848
,,,,,,,,UgzuC7uB9MJTtJE1KdR4AaABAg.8_1fU7w_yNP8_1iMC0U3Oh,SIXITHS,1 month ago,1510997154013,"+Sterling
Trading with China is not the same as them being your ally, don't be so naive.",3,/Negative/,Negative,0.994
,,,,,,,,UgzuC7uB9MJTtJE1KdR4AaABAg.8_1fU7w_yNP8_1iN84Pgwg,Mike C,1 month ago,1510997154015,Since when do allies finance attacks on each other?,1,/Positive/,Positive,0.742
,,,,,,,,UgzuC7uB9MJTtJE1KdR4AaABAg.8_1fU7w_yNP8_1iTRkajJU,Mike C,1 month ago,1510997154018,"Sterling 
Being a trade partner does not make china and the US allies...",2,/Negative/,Negative,0.996
,,,,,,,,UgzuC7uB9MJTtJE1KdR4AaABAg.8_1fU7w_yNP8_1vBA8nBlX,Europa H2O Alien,1 month ago,1510997154023,"deznuts: You desperately need a refresher course in geography. He's selling weapons to Japan, not China. Did you not listen to his speech or are you just getting your ""facts"" from the Young Turds and fake news?",0,/Negative/,Negative,0.938
,,,,,,,,UgzuC7uB9MJTtJE1KdR4AaABAg.8_1fU7w_yNP8_1weMUYl5q,samiamrg7,1 month ago,1510997154025,"+Europa H2O Alien Trump really is dumb if he thinks Japan is going to buy very many weapons. They have kept their military very small since WW2, and I doubt even the threat of aggression by North Korea would change that much. They already have as big a force as they believe they need, and they know the US has their back.",0,/Negative/,Negative,0.742
,,,,,,,,UgzuC7uB9MJTtJE1KdR4AaABAg.8_1fU7w_yNP8_1y0K6hazA,Sterling,1 month ago,1510997154028,"Trading doesn't make us military allies, but we are in a trade alliance with China. An alliance doesn't mean militarily",0,/Negative/,Negative,0.967
,,,,,,,,UgzuC7uB9MJTtJE1KdR4AaABAg.8_1fU7w_yNP8_1yN7cuW2B,Mike C,1 month ago,1510997154031,"Sterling what kind of alliance, if it's not militarily? 
Because last I looked it was china, Russia, Iran, Syria, 
North Korea that were allies. 
Mostly everyone else is neutral or NATO allies.",0,/Negative/,Negative,0.826
,,,,,,,,UgzuC7uB9MJTtJE1KdR4AaABAg.8_1fU7w_yNP8_1yf1W2Ct7,Sterling,1 month ago,1510997154034,"It's called a  trade alliance on the name of it, if you don't get it then there's no point of going from here as I can't explain it to you much clearer.",0,/Negative/,Negative,0.992
,,,,,,,,UgzuC7uB9MJTtJE1KdR4AaABAg.8_1fU7w_yNP8_2HY5WtVqW,samiamrg7,1 month ago,1510997154036,"+Mike C China produces their own weapons anyway. They don't need to buy them from the US. If anything, they will buy them from Russia if they have to since they are much closer militarily with Russia.",1,/Negative/,Negative,0.506
UgxumRIeWeeQZZBprvt4AaABAg,B-leechBaboon,1 month ago,1510997153518,checked and left- need to get rid of that lame rat,0,false,0,,,,,,,/Negative/,Negative,0.988
Ugw1I5aUb_fYvMw0vPR4AaABAg,Qwerty2OG,1 month ago,1510997153520,Goddamn...Ana sounds sexy.  Hope you're feeling not too ill,0,false,0,,,,,,,/Positive/,Positive,0.988
UgymN74FKMblpGqru3h4AaABAg,Holly,1 month ago,1510997153523,is ana ill ? her voice is so strange like shes has the flue or somethn,0,false,0,,,,,,,/Negative/,Negative,0.777
UgyoTUJV9aJ9JMcpqv94AaABAg,RedMoon,1 month ago,1510997153526,Ana be like: I'm so much better than you I got fake nose,0,false,0,,,,,,,/Positive/,Positive,0.561
UgxaNlR0srpP7TZoNDB4AaABAg,Holly,1 month ago,1510997153529,"why you say ""vietnam"" so strange whats wrong with vietnam ? at least its better then ""usa""",0,false,0,,,,,,,/Negative/,Negative,0.939
UgzPjOxz5Bt1lOCkLYd4AaABAg,shutdafup,1 month ago,1510997153532,Ana's voice sounds like Peppermint Patty,0,false,0,,,,,,,/Positive/,Positive,0.916
UgyjYhffX-if7bgdLCJ4AaABAg,Gordon Stewart,1 month ago,1510997153535,"Here it is again ,more evidence of a Trump Fascist oriented government. "" Big Business and Big Government  are formally united in their aims  and many aspects of their administrations"".",3,false,0,,,,,,,/Positive/,Positive,0.838
Ugw8sH2HU9mr8Ge5Pzl4AaABAg,PrasDominguez,1 month ago,1510997153538,TYT begging for Saudis money,0,true,2,,,,,,,/Negative/,Negative,0.992
,,,,,,,,Ugw8sH2HU9mr8Ge5Pzl4AaABAg.8_1cVq98uSW8_1dnboV319,Noiseless Sounds,1 month ago,1510997154045,no trump is,3,/Negative/,Negative,0.998
,,,,,,,,Ugw8sH2HU9mr8Ge5Pzl4AaABAg.8_1cVq98uSW8_1gk-gz3iY,Spartan155,1 month ago,1510997154047,PrasDominguez uhhhh have you ever heard them talk about Saudi Arabia before? Not exactly courting them,1,/Negative/,Negative,0.719
UgwhqhIeKIfDV5B4VAh4AaABAg,shutdafup,1 month ago,1510997153542,IMO the USA should not be selling weapons to any allies (not including The Anglosphere of course) .,1,true,1,,,,,,,/Negative/,Negative,0.734
,,,,,,,,UgwhqhIeKIfDV5B4VAh4AaABAg.8_1bxIoLqpE8_1drj8VWQw,Noiseless Sounds,1 month ago,1510997153921,racist.,1,/Positive/,Positive,0.41
UgxF-oHuHuB2JlTjq5t4AaABAg,Dwight Schrute,1 month ago,1510997153546,We need to recreate the anti war movement that occurred during the Vietnam war.,6,true,1,,,,,,,/Neutral/,Neutral,0.652
,,,,,,,,UgxF-oHuHuB2JlTjq5t4AaABAg.8_1bSyDYRIk8_1cpPJpV26,shutdafup,1 month ago,1510997153903,"Dwight Schrute --- It wasn't what it seems to be remembered like today --- It was violent and filled with terroristic acts cause by anti-war protestors --- It was a time when a poor guy went to Nam because it was the law, and when he came home anti-war protestors spat on him and called him baby killer .... There was no ""thank you for your service"" like today .......... Trust me, It was an awful time in American history",1,/Negative/,Negative,0.955
UgxCXvIThq63W56UlTx4AaABAg,EwE Whisperer,1 month ago,1510997153549,George Soros is a minorty now in America? You represent an actual X nazi anna you don't represent any American!,0,true,1,,,,,,,/Positive/,Positive,0.514
,,,,,,,,UgxCXvIThq63W56UlTx4AaABAg.8_1a_2MCD_l8_1rzfrv5hw,postmodern loser,1 month ago,1510997153929,Why does my pee pee turn yellow?,0,/Negative/,Negative,0.996
UgwfjypgPxFXT84yLt14AaABAg,EwE Whisperer,1 month ago,1510997153553,Ask anna aids who bailed her failing tyt out it wasn't poor people.,0,false,0,,,,,,,/Negative/,Negative,0.998
UgzibD-PtkUrd12uPUV4AaABAg,EwE Whisperer,1 month ago,1510997153556,Libtards are so delusional they think TRUTH is trolling...,1,true,2,,,,,,,/Negative/,Negative,0.918
,,,,,,,,UgzibD-PtkUrd12uPUV4AaABAg.8_1aPIJRA8E8_1bMv6LKLE,Dwight Schrute,1 month ago,1510997153874,You okay bro?,7,/Positive/,Positive,0.996
,,,,,,,,UgzibD-PtkUrd12uPUV4AaABAg.8_1aPIJRA8E8_1bvxcpFa3,Sinister Minister,1 month ago,1510997153877,Forget to take our meds did we?,8,/Negative/,Negative,0.951
UgwgBBcXPodYrpCVDp94AaABAg,Info Illness,1 month ago,1510997153560,"We need a WAR ON WAR right here, right now...",4,false,0,,,,,,,/Negative/,Negative,0.436
UgyyPya_1WGL50LapUh4AaABAg,Mausome,1 month ago,1510997153563,Remember the last time Obama landed in China they weren't even there to greet him? They probably thought he was just a young turd.,0,true,4,,,,,,,/Negative/,Negative,0.688
,,,,,,,,UgyyPya_1WGL50LapUh4AaABAg.8_1_0fv3J0J8_1afhdyXA8,RahYutKill,1 month ago,1510997154059,Mausome What a relevant arguing point you have.,3,/Negative/,Negative,0.928
,,,,,,,,UgyyPya_1WGL50LapUh4AaABAg.8_1_0fv3J0J8_1bIFiXZwC,Mausome,1 month ago,1510997154063,RahYutKill they pulled out the red carpet for Donald Trump because they have respect for him. Despite the fake news like this George Soros funded channel The Don is getting things done.,0,/Negative/,Negative,0.871
,,,,,,,,UgyyPya_1WGL50LapUh4AaABAg.8_1_0fv3J0J8_1d-84tiiY,HEΛRTS OF SPΛCE,1 month ago,1510997154065,"@Mausome Lol, do you ever get tired of winning?",1,/Negative/,Negative,0.975
,,,,,,,,UgyyPya_1WGL50LapUh4AaABAg.8_1_0fv3J0J8_1hk7VPNqV,Mausome,1 month ago,1510997154067,HEΛRTS OF SPΛCE Christmas everyday,0,/Positive/,Positive,0.906
UgzUzf5lrrpHox29Y0F4AaABAg,dandiehl1948,1 month ago,1510997153567,America; death merchant to the world,8,false,0,,,,,,,/Positive/,Positive,0.955
UgzU5BFYa4-ywh-qH9d4AaABAg,Ekkie101,1 month ago,1510997154932,The Trumpoids are out in force today. Their logic is even faultier than their grammar.,6,false,0,,,,,,,/Negative/,Negative,0.834
Ugzm9KX_o7YXMREttYh4AaABAg,Oliver Garcia,1 month ago,1510997154935,Great video! I completely agree with these 3 ladies!,4,false,0,,,,,,,/Positive/,Positive,0.998
UgxPUAvwFVkrEo0_AVB4AaABAg,김상윤,1 month ago,1510997154938,"I just want to say that people in my country, which is South Korea, changed their view on Trump after his visit. They now think highly of him and some even sympathize with his claim that the media is disparaging him in an unjust way. Selling weapons to allies helps Americans. It boosts employment and contribute to protecting America.",2,true,19,,,,,,,/Positive/,Positive,0.824
,,,,,,,,UgxPUAvwFVkrEo0_AVB4AaABAg.8_1ZZhJkq7M8_1ZiaU4Cul,Info Illness,1 month ago,1510997155524,Yeah right -I really really really believe that....,3,/Positive/,Positive,0.559
,,,,,,,,UgxPUAvwFVkrEo0_AVB4AaABAg.8_1ZZhJkq7M8_1_Ez-gkSL,김상윤,1 month ago,1510997155526,"It's true. If you look at the comment section of news articles related to Trump's visit, you will find most people praising Trump.",1,/Positive/,Positive,0.869
,,,,,,,,UgxPUAvwFVkrEo0_AVB4AaABAg.8_1ZZhJkq7M8_1auDwcIAA,MorpheusGodofDreams,1 month ago,1510997155529,"of course you will, that's like saying lets look at fox news article's comment section and you'll see people praising trump.......",2,/Positive/,Positive,0.746
,,,,,,,,UgxPUAvwFVkrEo0_AVB4AaABAg.8_1ZZhJkq7M8_1cIHE8lOm,Matt Alibozek,1 month ago,1510997155531,Don't buy Trumps Bullshit... He is a CON MAN...,1,/Negative/,Negative,0.875
,,,,,,,,UgxPUAvwFVkrEo0_AVB4AaABAg.8_1ZZhJkq7M8_1eBlXqGeI,김상윤,1 month ago,1510997155533,"I used to think like you. But after all, it seems like he is not so bad a person.",0,/Negative/,Negative,0.998
,,,,,,,,UgxPUAvwFVkrEo0_AVB4AaABAg.8_1ZZhJkq7M8_1hlbVCw-J,kahmaal14,1 month ago,1510997155536,"김상윤 I'm glad that people like you have awaken to the smear fest the media and the left is trying to paint Trump as..

I used to hate Trump because of what most of my friends, family and media were saying about him too.

I decided to listen to one of these ""white supremist"" talking highly about Trump to figure out what they are exactly going to do and found out it was all a lie to make Trump look bad.

I'm sad my dad convinced me to vote for Hillary because the dirt on her is outrageous if you actually know how to do research and put in the extra effort.

If people look hard enough they will surprisingly find a couple of democrats that actually support him too.

all it takes is for people to hear both sides before making a decision.",1,/Negative/,Negative,0.656
,,,,,,,,UgxPUAvwFVkrEo0_AVB4AaABAg.8_1ZZhJkq7M8_1hsj6YZIC,kahmaal14,1 month ago,1510997155538,Matt Alibozek what evidence do you actually have that he's a con man? if you have it in your head that all business owners and wealthy people are con artists then I just want you to know you are misled.,0,/Positive/,Positive,0.613
,,,,,,,,UgxPUAvwFVkrEo0_AVB4AaABAg.8_1ZZhJkq7M8_1mIQO2GWY,Drink Water,1 month ago,1510997155540,"south korea is owned by america, korea was taken over by the west during the korean war",0,/Positive/,Positive,0.789
,,,,,,,,UgxPUAvwFVkrEo0_AVB4AaABAg.8_1ZZhJkq7M8_1moL4tNb1,kahmaal14,1 month ago,1510997155542,"Drink Water define ""owned""

because by that assertion anybody can easily say America owns Mexico, and Japan too

it doesn't sound right though because they are independent countries and not a part of the United States like Puerto Rico is now.",0,/Positive/,Positive,0.633
,,,,,,,,UgxPUAvwFVkrEo0_AVB4AaABAg.8_1ZZhJkq7M8_1piAtN6Wg,Drink Water,1 month ago,1510997155544,"yes white man owns japan too after they dropped nukes on them and took over their economy and retrict them frm having weapons and supply them with weapons after colonising them with occupied army bases. same with vietnam, they bombed them and raped and killed now sell vietnam weapons and same with philipines. none of these places are independent, but i dont think these countries mind, they  dont mins being subservient to white man and money. its just the way the wold works",0,/Negative/,Negative,0.893
,,,,,,,,UgxPUAvwFVkrEo0_AVB4AaABAg.8_1ZZhJkq7M8_1qXJqGEIw,kahmaal14,1 month ago,1510997155547,"Drink Water okay now you are just using race to justify America colonizing different areas.

just because white people were the majority doesn't mean others weren't involved in helping fight wars too.. if America wanted to stay owned by white men it would have. instead we come together despite our disagreements to protect our country in the end.

who is this ""white man"" anyway are Italians and jews part of the white men too? what about Spaniards? how do you define white men?",0,/Negative/,Negative,0.789
,,,,,,,,UgxPUAvwFVkrEo0_AVB4AaABAg.8_1ZZhJkq7M8_1sdgCJR0Z,Drink Water,1 month ago,1510997155549,"white man invented race to praictice racism and mistreatment of non white peoples. tehre is only one race which is the white race. and scientifically they are not a race, just albino, but as the world order goes they re the only race in existence. italians and eurojews like drumpf etc got adopted as white as america evolved so they could enjoy the legal benefit of white priveileges by mistreatng people of color. like irish were given police epartment, jews wre given banks and media and italians drug and weapon trade and fire dept etc. british white used to hate irish but now in nwo there is no irish, no british, no germna, no russian, tehre is only white or non white. white is a moving target determined only by the white supremacists. regular people dont decide who is white race, or who is not

im in no poisition to define whtie race because i am a brown man, that right is reserved for the white surpemacists but white people are just albino. even my race is not defined by me but the white surpemacist, today i could be brown race, tomorrow black race or red race or yellow race, or whatever label the white supremacist wants to label me as. they decide when they will bomb me, i dont make that choice

even if white were minority in usa and they didnt kill the natives and imprison all the blacks and keep out all the mexicans and muslims etc it would still b owned by the white elites. america is just a colony of the white british empire",0,/Negative/,Negative,0.914
,,,,,,,,UgxPUAvwFVkrEo0_AVB4AaABAg.8_1ZZhJkq7M8_1ydn7JJc3,Bathrobe Battousai,1 month ago,1510997155551,"Nope, Trump is still a corrupt idiot. You drank the kool-aid.",0,/Positive/,Positive,0.633
,,,,,,,,UgxPUAvwFVkrEo0_AVB4AaABAg.8_1ZZhJkq7M8_2-mcAf6Zi,kahmaal14,1 month ago,1510997155554,"Drink Water by that theory you would have to assume white people created everything,

 although I believe they stole ideas and unfairly had white privileges back in the day all the way up to the 60s it began to change when Martin Luther King got into position. the people that were REALLY in power couldn't stand him or jfk, which is why they got assassinated.",0,/Negative/,Negative,0.805
,,,,,,,,UgxPUAvwFVkrEo0_AVB4AaABAg.8_1ZZhJkq7M8_2-sVTxtAa,kahmaal14,1 month ago,1510997155556,Bathrobe Battousai kool-aid huh? you want to explain why you're right and others are wrong?,0,/Negative/,Negative,0.994
,,,,,,,,UgxPUAvwFVkrEo0_AVB4AaABAg.8_1ZZhJkq7M8_2068yF-pw,Bathrobe Battousai,1 month ago,1510997155558,"kahmaal14 no, I don’t care.",0,/Negative/,Negative,0.998
,,,,,,,,UgxPUAvwFVkrEo0_AVB4AaABAg.8_1ZZhJkq7M8_20hWshy-e,Drink Water,1 month ago,1510997155561,"theory? this is reality. why would i believe white people created everything? i said they invented racism not air or water. they steal air and water though, and are best at killing and deceiving thats for sute. but even those things were not invented by them. jfk did not get assassinated that was a hoax, he is probably jimmy carter or somone now. mlk got assasinated because he said he wanted white and non white kids to play together but he didnt realise that living together pisses the white supremacist off because white fear genetic anihilation more than any other creature on the planet. mlk didnt ""get"" into posiion. the white establishment uses people of color for their agenda all the time and takes them out when they are not necessary for the white agenda anymore. the system of white supremacy is more refined today than ever before, thats why slow people like you cant even see it. its like air to you now, you dont know any better and how could you unless someone like me snaps you out of your delusions. even then you will go back to sleep. why? because the matrix has blinded you to think this is some romantic history and you cant see whats happening today itself. coginitive dissonance",0,/Negative/,Negative,0.928
